youtube_id,title,publishedAt,channel_name
TShN4xAzZ2w,CT State Advisory Council for Special Education (Membership Committee) - 11/9/23,2023-11-09T18:18:11Z,CT State Department of Education
DpgyDeismQc,State Board of Education Meeting - 11/8/2023,2023-11-09T07:15:48Z,CT State Department of Education
3tlTwPemUOc,2023-24 Accessibility Guidelines for the LAS Links Online Administration,2023-11-08T18:41:55Z,CT State Department of Education
mmV6eLqxcHs,State Board of Education Meeting - 11/6/2023,2023-11-07T04:22:58Z,CT State Department of Education
hxHSweKqYjY,"Talk Tuesday, October 31, 2023",2023-11-03T19:00:12Z,CT State Department of Education
n-AlhN50xB8,CSDE Policies for LAS Links Online Administration Training,2023-11-03T18:51:42Z,CT State Department of Education
hy7Oax1cKCo,CT SAT Tech Coordinator Training,2023-11-03T13:20:18Z,CT State Department of Education
MZqmfOmlNiQ,State Board of Education Meeting - 11/1/2023,2023-11-02T03:25:47Z,CT State Department of Education
sMq14rV9C1c,Behind the Numbers: Multiple Ways of Understanding Student Growth,2023-11-01T18:58:22Z,CT State Department of Education
aXnpife8mmU,Increasing Educator Diversity (IED) Plan Informational Session Webinar,2023-10-31T17:07:13Z,CT State Department of Education
cARivg53U10,Connecticut High-Dosage Tutoring Kickoff Event,2023-10-30T15:33:09Z,CT State Department of Education
H9m6_wD7mIg,CT State Advisory Council for Special Education (Full Council) - 10/25/23,2023-10-26T02:53:59Z,CT State Department of Education
hTjvcSj269s,"Talk Tuesday, 9/19/23",2023-10-24T17:11:49Z,CT State Department of Education
x59djF5mGlc,"Talk Tuesday, October 17, 2023",2023-10-24T17:07:09Z,CT State Department of Education
NpdO1K8VmbA,"Talk Tuesday, 10/3/2023",2023-10-20T16:52:15Z,CT State Department of Education
u0IOA9teDQs,"Talk Tuesday, Summer Series ""Back to Basics,"" August 8, 2023",2023-10-20T16:48:50Z,CT State Department of Education
qIaEfCdmffM,"Talk Tuesday ""Summer Back to Basics"" 7/18/2023",2023-10-20T16:45:04Z,CT State Department of Education
asJoll4pcxw,CT State Advisory Council for Special Education (Full Council) - 1/17/23,2023-10-12T18:59:01Z,CT State Department of Education
yYiZPqC083k,CT State Advisory Council for Special Education (Executive Committee) - 1/3/24,2023-10-12T16:35:50Z,CT State Department of Education
ZUVX1UiR4N4,CT State Advisory Council for Special Education (Executive Committee) - 11/17/23,2023-10-12T16:34:47Z,CT State Department of Education
89loZSKELjE,CT State Advisory Council for Special Education (Executive Committee) - 10/11/23,2023-10-12T04:23:09Z,CT State Department of Education
s4mjrmMshjU,"Dual Credit Community of Practice, October 10, 2023",2023-10-11T19:35:57Z,CT State Department of Education
hWrJQtdIDwY,Webinar for Districts Who Requested Waiver of CT Approved K–3 Reading Curriculum Models or Programs,2023-10-10T19:29:10Z,CT State Department of Education
_5sPSgFNnwU,US Senate Youth Program Webinar,2023-10-05T16:58:57Z,CT State Department of Education
TZ7r9JMoZ1A,State Board of Education Meeting - 10/4/2023,2023-10-05T04:07:10Z,CT State Department of Education
wdQ_p7LMGQw,CT SAT Test Coordinator Training Part 1,2023-09-29T15:23:07Z,CT State Department of Education
dQKtkXJOVDs,State Board of Education Meeting - Accountability and Support Committee - 9/20/2023,2023-09-21T08:06:02Z,CT State Department of Education
tMn8TSOsulc,Reading Leadership Implementation Council - 9/19/23,2023-09-20T06:26:24Z,CT State Department of Education
vMP8Pfy5EzQ,Interagency Council for Ending the Achievement Gap - 9/19/23,2023-09-20T06:09:37Z,CT State Department of Education
q2JNcgeEZro,Dual Credit Community of Practice Kick-Off Meeting,2023-09-14T18:50:00Z,CT State Department of Education
m-63mYgFqYQ,2023-24 FAFSA Challenge Webinar,2023-09-14T13:34:43Z,CT State Department of Education
wYRJ6f0HlMo,CT State Advisory Council for Special Education (Full Council) - 9/13/23,2023-09-14T03:19:38Z,CT State Department of Education
xIf87-uEpl0,"Behind the Numbers: From Data to Dashboards, Accountability Estimator Tool",2023-09-11T12:53:26Z,CT State Department of Education
1UgQPICGzE4,Connecticut Stronger Connections Grant Program Informational Webinar,2023-09-07T18:01:59Z,CT State Department of Education
6FPfywb_kr0,State Board of Education Meeting 9/6/2023,2023-09-07T05:31:52Z,CT State Department of Education
wuj1XYt9DkA,CT State Advisory Council for Special Education (Executive Committee) - 9/5/23,2023-09-06T03:25:22Z,CT State Department of Education
wLERh0r7Jtg,Unwrapping the Social Studies Standards - Professional Learning Session 2,2023-08-03T13:50:59Z,CT State Department of Education
-OuHgD-B9bk,State Board of Education Meeting 8/2/2023,2023-08-03T02:33:56Z,CT State Department of Education
ikd7p34cS-I,CT State Advisory Council for Special Education (Full Council) - 7/19/23,2023-07-20T03:41:45Z,CT State Department of Education
QLi7geFDWp8,Interagency Council for Ending the Achievement Gap - 7/18/23,2023-07-18T19:40:20Z,CT State Department of Education
-eHMgnPh-ZY,Unwrapping the Social Studies Standards - Professional Learning Session 1,2023-07-17T15:51:32Z,CT State Department of Education
08qgPsvCBrU,Informe Individualizado del Alumno con Respecto a las Evaluaciones Smarter Balanced de Connecticut,2023-07-14T15:14:49Z,CT State Department of Education
OSYvndIE1QY,"A Parent's Guide to the CT Smarter Balanced Test, Individual Student Report",2023-07-13T18:49:43Z,CT State Department of Education
8K9o7BqD2f8,CT State Advisory Council for Special Education (Executive Committee) - 7/12/23,2023-07-13T03:33:23Z,CT State Department of Education
axiYQIMhhyU,State Board of Education Meeting 6/30/2023,2023-07-01T03:09:57Z,CT State Department of Education
yE6nPALgHT4,CSDE High-Dosage Tutoring LEA Information Webinar,2023-06-28T18:09:23Z,CT State Department of Education
_FGkUDM-bkA,Reading Leadership Implementation Council - 6/20/23,2023-06-21T06:53:27Z,CT State Department of Education
nAdaFQLsgJw,State Board of Education Meeting 6/14/2023,2023-06-15T04:24:49Z,CT State Department of Education
DMBkY-eXVR4,CT State Advisory Council for Special Education (Executive Committee) - 6/7/23,2023-06-08T02:18:17Z,CT State Department of Education
IFzh0ltcv2o,"Behind the Numbers: From Data to Dashboards, Postsecondary Readiness Report",2023-06-07T12:52:28Z,CT State Department of Education
o1nyJMBdIi8,Video Instructivo de PSOS,2023-06-05T16:06:35Z,CT State Department of Education
ACx-G8nfgUk,PSOS Instructional Video,2023-06-05T14:24:15Z,CT State Department of Education
jxRSMMTuN-s,Dual Credit Expansion Grant Program: IHE Session 4 of 4,2023-06-01T16:18:43Z,CT State Department of Education
KHWgyhDAhFM,Dual Credit Expansion Grant Program: IHE Session 2 of 4,2023-06-01T16:18:34Z,CT State Department of Education
c3zSrUm3PI8,Dual Credit Expansion Grant Program: IHE Session 3 of 4,2023-06-01T16:18:23Z,CT State Department of Education
ehYmn3jGs3c,Dual Credit Expansion Grant Program: IHE Session 1 of 4,2023-05-24T12:48:58Z,CT State Department of Education
HTzCsvFKcr8,Connecticut Physical Fitness Assessment Teams Meeting Webinar,2023-05-22T18:12:49Z,CT State Department of Education
7_ettUvRxUY,"Talk Tuesday, May 16, 2023",2023-05-18T19:00:17Z,CT State Department of Education
I4PNT4VpXdo,Reading Leadership Implementation Council - 5/16/23,2023-05-17T06:41:01Z,CT State Department of Education
JBVa97Z51XU,"Talk Tuesday, April 18, 2023",2023-05-16T12:16:55Z,CT State Department of Education
C5YAczfFX54,"Talk Tuesday, May 2, 2023",2023-05-16T12:10:11Z,CT State Department of Education
Cncr7u2pVoY,State Board of Education - Academic Standards and Assessment Committee Meeting 5/15/2023,2023-05-16T08:08:25Z,CT State Department of Education
36Tj15EUWDA,"Behind the Numbers: From Data to Dashboards, Find Contacts and Indicator 4",2023-05-15T17:09:13Z,CT State Department of Education
NW7uNO4O66g,2024 CT SAT New Digital Test,2023-05-11T18:45:29Z,CT State Department of Education
QhwEZa6HlbM,Dual Credit Expansion Grant Program: District Information Session,2023-05-09T17:41:59Z,CT State Department of Education
wSjN-JJ0XUw,CT State Advisory Council for Special Education (Executive Committee) - 5/8/23,2023-05-09T01:42:41Z,CT State Department of Education
i2yHQMG1kaw,"2023 Summative Testing Office Hours for Smarter Balanced, NGSS, CTAA, and CTAS May 5, 2023",2023-05-05T17:55:30Z,CT State Department of Education
k2bPfpS8IqU,State Board of Education Meeting 5/3/2023,2023-05-04T03:20:00Z,CT State Department of Education
6S9BckzR4HU,"2023 Summative Testing Office Hours for Smarter Balanced, NGSS, and the Alternate Assessments",2023-05-01T12:36:34Z,CT State Department of Education
ZxYxDcAiD34,CT State Advisory Council for Special Education (Membership Committee) - 4/28/23,2023-04-28T12:48:38Z,CT State Department of Education
-IovYs_3OMc,State Board of Education Special Meeting  4/19/2023,2023-04-27T14:50:31Z,CT State Department of Education
ZS1hno5_aAI,"2023 Summative Testing Office Hours for Smarter Balanced, NGSS, and the Alternate Assessment System",2023-04-26T19:26:23Z,CT State Department of Education
uhCCzA1-M6M,"Summative Testing Office Hours for Smarter Balanced, NGSS, CTAA, and CTAS 4/6/23",2023-04-25T13:13:52Z,CT State Department of Education
kZNdSQEiXw0,"Behind the Numbers: From Data to Dashboards, TCS Data and Accountability",2023-04-24T15:24:34Z,CT State Department of Education
Y6nm2IBGM14,CT State Advisory Council for Special Education (Executive Committee) - 4/19/23,2023-04-20T01:43:27Z,CT State Department of Education
p9QcHUU4T8c,CT State Advisory Council for Special Education (Membership Committee) - 4/18/23,2023-04-19T04:35:25Z,CT State Department of Education
pAAKNgr97kU,Navegando el Nuevo Proceso de la Lista de Espera,2023-04-17T18:23:31Z,CT State Department of Education
yE--OFWLg6E,Navigating RSCO's New Waitlist Process,2023-04-14T14:30:12Z,CT State Department of Education
vqp6RwQya5g,CT State Advisory Council for Special Education (Legislative Committee) - 4/13/23,2023-04-14T03:47:42Z,CT State Department of Education
z9BqLhwpOl4,Certification Webinar for Connecticut HR Personnel,2023-04-12T18:00:50Z,CT State Department of Education
ZuzFm_hMubU,"Talk Tuesday, April 4, 2023",2023-04-12T17:53:39Z,CT State Department of Education
wSMIl5NFqlE,Remote Learning Commission - 4/6/23,2023-04-07T02:36:47Z,CT State Department of Education
Rfm0uMlxCW0,"Talk Tuesday, March 21, 2023",2023-04-04T19:20:03Z,CT State Department of Education
ChBZnyCakv4,2023 Summative Testing Office Hours for Smarter Balanced Next Generation Science Standards CTAA and,2023-04-03T17:23:47Z,CT State Department of Education
XahkAz0sw1w,Connecticut Comprehensive School Counseling Framework Training Module 2,2023-03-31T12:33:22Z,CT State Department of Education
Fpasjphfu7A,Connecticut Comprehensive School Counseling Framework Training Module 3,2023-03-31T12:33:09Z,CT State Department of Education
yops9mUSQoA,Connecticut Comprehensive School Counseling Framework Training Module 4,2023-03-31T12:31:28Z,CT State Department of Education
up3lnH0j82c,Connecticut Comprehensive School Counseling Framework Training Module 5,2023-03-31T12:30:33Z,CT State Department of Education
ESPHVR5Dvdo,Connecticut Comprehensive School Counseling Framework Training Module 1,2023-03-31T12:29:21Z,CT State Department of Education
8nCDczDOXss,Connecticut Comprehensive School Counseling Framework Training Modules - Introduction,2023-03-31T12:27:29Z,CT State Department of Education
WpQ8otUzK3g,Connecticut Comprehensive School Counseling Framework Training Module 6,2023-03-31T12:26:11Z,CT State Department of Education
n9183sCpkaI,CT State Advisory Council for Special Education (Legislative Committee) - 3/30/23,2023-03-31T04:13:25Z,CT State Department of Education
HoKy6GoDNAs,CT State Advisory Council for Special Education (Full Council) - 3/29/23,2023-03-30T02:54:43Z,CT State Department of Education
8s0QZQsTApA,Voice4Change Panel at 2023 CCSSO Legislative Conference,2023-03-24T22:47:20Z,CT State Department of Education
YGET0rsI_qk,CT State Advisory Council for Special Education (Executive Committee) - 3/22/23,2023-03-23T02:21:48Z,CT State Department of Education
dA_SYC2uj7A,CT State Advisory Council for Special Education (Membership Meeting) - 3/17/23,2023-03-18T02:53:42Z,CT State Department of Education
UnYIihW2DsU,CT State Advisory Council for Special Education (Legislative Committee) - 3/16/23,2023-03-17T04:59:13Z,CT State Department of Education
KuDi2YS3Sm4,CSDE Summer Enrichment Grant Program Informational Webinar,2023-03-16T19:21:16Z,CT State Department of Education
zOj23NETaQQ,"Talk Tuesday, February 7, 2023",2023-03-10T18:25:01Z,CT State Department of Education
Hyqp5H4KvO8,"Talk Tuesday, March 7, 2023",2023-03-10T18:24:51Z,CT State Department of Education
MvEkJO5n5oU,"Talk Tuesday, February 21, 2023",2023-03-10T18:17:12Z,CT State Department of Education
k0QLws7tQ3k,SMC RFP Process Open Office Hour Discussion: 3.10.23 9am-10am,2023-03-10T18:13:05Z,CT State Department of Education
5ZnJPzx_p0I,Interagency Council for Ending the Achievement Gap - 3/7/23,2023-03-08T07:44:27Z,CT State Department of Education
15yVjI9I9rI,CT State Advisory Council for Special Education (Legislative Committee) - 3/2/23,2023-03-03T06:04:48Z,CT State Department of Education
AL3TOf1WfOQ,State Board of Education Meeting  3/1/2023,2023-03-01T21:37:31Z,CT State Department of Education
-hs5t7bpKew,"E-Learning Series on Attendance, Session III, with Attendance Works",2023-02-27T14:35:35Z,CT State Department of Education
KVnxvWAcT38,CT State Advisory Council for Special Education (Executive Committee) - 2/22/23,2023-02-23T04:48:27Z,CT State Department of Education
-dfrhLY9yHo,CT State Advisory Council for Special Education (Full Council) - 2/22/23,2023-02-23T03:52:48Z,CT State Department of Education
SvsW4zzpUJ8,CSDE/DAS CTSource Training for NSLP Sponsors,2023-02-22T19:01:51Z,CT State Department of Education
QD89A03RyPc,"E-Learning Series on Attendance with Attendance Works, February 9, 2023",2023-02-21T21:01:21Z,CT State Department of Education
ORrQE2Ob-OE,CT SAT 2023 SSD Coordinator Training,2023-02-14T14:06:43Z,CT State Department of Education
tUKRWGeNcW4,CT SAT 2023 Test Coordinator Training,2023-02-14T13:57:48Z,CT State Department of Education
UW7LrMIIcsQ,"Talk Tuesday, January 10, 2023",2023-02-03T14:12:33Z,CT State Department of Education
eV3Wk3abeXA,State Board of Education Meeting  2/1/2023,2023-02-02T05:11:17Z,CT State Department of Education
wOPFMaV211k,Getting Started in CT-SEDs: Guide for Educator Prep Candidates,2023-02-01T20:20:28Z,CT State Department of Education
NAfauQGnsVg,CSDE OSEP District 10/1/22 Child Count Verification,2023-02-01T12:19:20Z,CT State Department of Education
xrhqxmmJVa4,"Talk Tuesday, January 24, 2023",2023-01-30T20:21:23Z,CT State Department of Education
_zgPX3bQ-FI,"E-Learning Series on Attendance & Engagement with Attendance Works, Session 1",2023-01-26T21:43:06Z,CT State Department of Education
rk-tNua2FS0,District Administrators (DA's in TIDE) Virtual Training,2023-01-24T20:02:15Z,CT State Department of Education
v_go3THfTbg,Reading Leadership Implementation Council - 1/17/23,2023-01-18T07:55:17Z,CT State Department of Education
4uor4O26O5o,CT SAT School Day Technology Coordinator Overview,2023-01-13T16:50:49Z,CT State Department of Education
C6gYi4orsX0,CT-SEDS Follow-Up Training for APSEPs,2023-01-12T14:52:09Z,CT State Department of Education
52nMzfljTAY,CT State Advisory Council for Special Education (Full Council) - 1/11/23,2023-01-12T06:40:34Z,CT State Department of Education
ETJku1Qxtw0,CT State Advisory Council for Special Education (Executive Committee) - 1/11/23,2023-01-12T06:25:48Z,CT State Department of Education
iZv4E84KEtU,State Board of Education Meeting  1/11/2023,2023-01-12T05:25:53Z,CT State Department of Education
4HB_Q_4bPEQ,How-to Video for RSCO’s 2023-24 Application,2022-12-20T20:27:38Z,CT State Department of Education
BiRrv6lvCQA,CSDE McKinney-Vento No Matter What Campaign 2023,2022-12-15T22:04:39Z,CT State Department of Education
MlkKPI-1foU,"Talk Tuesday, December 13, 2022",2022-12-14T17:29:32Z,CT State Department of Education
O-MqgdmoOUw,"Talk Tuesday, November 29, 2022",2022-12-14T14:51:30Z,CT State Department of Education
qdFdbArzUOU,"Talk Tuesday, November 15, 2022",2022-12-14T14:47:52Z,CT State Department of Education
vW3Vt755JLc,CT State Advisory Council for Special Education (Membership Committee) - 12/12/22,2022-12-13T05:55:20Z,CT State Department of Education
cuFJDQmdcIA,DRC INSIGHT Technology Training Webinar for LAS Links Lead Information Technology (IT) Coordinators,2022-12-12T18:14:24Z,CT State Department of Education
jTrmbERLziE,Promoting Access Using AP Seminar English 10,2022-12-12T18:07:51Z,CT State Department of Education
cpzsxu0FPUE,2022-23 ELAC Training for LAS Administration,2022-11-22T19:22:15Z,CT State Department of Education
z29-jzghqio,Reading Leadership Implementation Council - 11/16/22,2022-11-17T21:00:52Z,CT State Department of Education
KUoSSbLLreI,"State Board of Education Legislation and Policy Development Committee, 11/16/22",2022-11-17T08:22:30Z,CT State Department of Education
4k2BVkV1-kc,CT SAT SSD Coordinator Overview,2022-11-14T19:39:37Z,CT State Department of Education
aS8vT-tZDFo,CT State Advisory Council for Special Education (Executive Committee) - 11/10/22,2022-11-11T03:36:53Z,CT State Department of Education
HmxtYvBYkG4,Financial Aid and the Pledge to Advance Connecticut for CT State,2022-11-10T13:46:29Z,CT State Department of Education
yqNLwDsqL7g,2023 CT SAT School Day Overview,2022-11-04T18:13:45Z,CT State Department of Education
s0RbDgM9Dkg,CT State Advisory Council for Special Education (Executive Committee) - 10/26/22,2022-10-27T02:56:50Z,CT State Department of Education
Uvb7-8SQTzA,CT State Advisory Council for Special Education (Full Council) - 10/26/22,2022-10-27T02:38:40Z,CT State Department of Education
agbOjrdQMD4,"Talk Tuesday, October 18, 2022, Session",2022-10-19T15:25:08Z,CT State Department of Education
CQhLv6GmzGY,Reading Leadership Implementation Council - 10/18/22,2022-10-19T10:28:40Z,CT State Department of Education
q518FY3INh4,CT State Advisory Council for Special Education (Executive Committee) - 10/18/22,2022-10-19T08:30:30Z,CT State Department of Education
HT1UdtMemdg,CT State Advisory Council for Special Education (Membership Committee) - 10/14/22,2022-10-15T02:09:56Z,CT State Department of Education
qv2sKzGP_B8,Reading Leadership Implementation Council - 10/3/22,2022-10-04T01:37:25Z,CT State Department of Education
RUueGuzS4NQ,CT State Advisory Council for Special Education (Full Council) - 9/28/22,2022-09-29T04:16:40Z,CT State Department of Education
fBqu7jy-aX8,Reading Leadership Implementation Council - 9/20/22,2022-09-21T06:29:22Z,CT State Department of Education
vS4yLrBadFQ,Reading Leadership Implementation Council - 8/16/22,2022-08-17T06:42:44Z,CT State Department of Education
cWkPqjpGfJQ,"Attendance & Engagement Community of Practice, May 19, 2022",2022-08-16T13:53:17Z,CT State Department of Education
mPsFFDfb42E,Surrogate Parent Meeting 8-4-2022,2022-08-05T18:17:53Z,CT State Department of Education
lE_8VNQE7CA,Reading Leadership Implementation Council - 7/26/22,2022-07-27T06:36:03Z,CT State Department of Education
vF6-wYZWYXc,Guia para Padres: Evaluaciones Smarter Balanced de Connecticut,2022-07-22T19:13:29Z,CT State Department of Education
1Yvl88MqZH8,Leveraging Multi-Tiered Systems of Support (MTSS) to Enhance Educational Leadership,2022-07-22T18:36:09Z,CT State Department of Education
NofzECDcb2E,Introducing the CT Learning Hub 2.0 – a FREE Resource for All CT Learners,2022-07-21T14:36:45Z,CT State Department of Education
ATdqsQsN2Rs,Connecticut Remote Learning Commission - 7/18/22,2022-07-19T07:34:42Z,CT State Department of Education
IhH3b0U-vdE,"A Parent’s Guide to the CT Smarter Balanced Test, Individual Student Report",2022-07-18T20:04:46Z,CT State Department of Education
iRY8cFJwTbk,How-to Video for RSCO’s New Application Process,2022-07-01T12:50:42Z,CT State Department of Education
haJWu1l0gLU,Summer 2022 PSA,2022-06-23T17:05:43Z,CT State Department of Education
so5wx0HiecU,Summer 2022 PSA (Spanish Subtitles),2022-06-23T17:05:40Z,CT State Department of Education
QXVYNLWTQO8,Connecticut Remote Learning Commission - 6/13/22,2022-06-14T06:42:12Z,CT State Department of Education
E_DGs_c52eQ,Governor's Summer Reading Challenge,2022-06-01T02:50:54Z,CT State Department of Education
YbF0FliqpVY,CT-SEDS IEP Preview Series - Session 11: Progress Reports and Amendments (5/23/22),2022-05-24T13:09:15Z,CT State Department of Education
lLeq_dnq-lI,CT-SEDS IEP Preview Series - Session 10: State Testing (5/16/22),2022-05-17T16:27:55Z,CT State Department of Education
CQfvkhpRfGs,Connecticut Remote Learning Commission - 5/16/22,2022-05-17T06:39:16Z,CT State Department of Education
ip6uJg7BRnk,School Discipline Collaborative Meeting - 3/24/22,2022-05-12T15:02:59Z,CT State Department of Education
ogYro1Q_t1A,Reading Leadership Implementation Council - 5/10/22,2022-05-11T06:37:09Z,CT State Department of Education
nAE7DT1fGTc,CT-SEDS IEP Preview Series - Session 9: Supplementary Aids and Services (5/9/22),2022-05-10T12:47:14Z,CT State Department of Education
QYEPildU_qY,"CT-SEDS IEP Preview Series - Session 8: Service Delivery Grid, Indirect Service, Transport  (5/2/22)",2022-05-06T13:44:28Z,CT State Department of Education
ifG_Yfa9fmM,Teacher Appreciation Week 2022 Message,2022-05-06T13:44:03Z,CT State Department of Education
hwp0jvg08gQ,"State Board of Education Meeting,  5/4/22",2022-05-04T18:36:55Z,CT State Department of Education
Bh5Fz62WKB0,Reading Leadership Implementation Council - 4/26/22,2022-04-27T06:42:35Z,CT State Department of Education
qFLnmX9IZHs,CT-SEDS IEP Preview Series - Session 7: Secondary Transition (4/25/22),2022-04-26T13:56:29Z,CT State Department of Education
Y1XQgS-dN8A,"CSDE, CREC, and RESC Alliance CT Home Visit Hub - LEAP Home Visits",2022-04-22T18:56:38Z,CT State Department of Education
olRIenND2ow,Leveraging Student Voice to Spark Change,2022-04-20T16:31:23Z,CT State Department of Education
PiHJNghZCd0,Connecticut Remote Learning Commission - 4/18/22,2022-04-19T06:37:55Z,CT State Department of Education
E61l5jAbxtg,CT-SEDS IEP Preview Series - Session 6: Present Levels of Performance Goals & Objectives (4/11/22),2022-04-12T17:42:06Z,CT State Department of Education
D9B15lCweU4,English Language Proficiency Growth Model,2022-04-12T17:41:10Z,CT State Department of Education
qECwClGWAao,Voice4Change Winners Announcement,2022-04-08T14:39:54Z,CT State Department of Education
TVw2fFq4tiE,Local School Wellness Policy Triennial Assessment: Entering Your WellSAT-I Scores Online,2022-04-06T19:18:21Z,CT State Department of Education
UL8RZNo_rnY,CT-SEDS IEP Preview Series - Session 5: Diagnostic Placement & IEP Special Considerations (4/4/22),2022-04-05T15:47:27Z,CT State Department of Education
XRS97fQh29o,Office Hours for 2022 Summative Testing  - 3/31/22,2022-04-04T18:37:05Z,CT State Department of Education
BjWjaYec16s,CT-SEDS IEP Preview Series - Session 4: Referral and Eligibility Determination (3/28/22),2022-03-29T13:35:37Z,CT State Department of Education
hqoTZHB1wl8,March 2022 Attendance & Engagement Community of Practice,2022-03-28T19:01:36Z,CT State Department of Education
ALkZgKwN7Pc,Reading Leadership Implementation Council - 3/24/22,2022-03-25T06:43:15Z,CT State Department of Education
3P-Xd85O3Bk,Remote Learning Commission Meeting - 3/21/22,2022-03-22T17:41:12Z,CT State Department of Education
JvXEjviYBv0,"March 17, 2022 Student Assessment Office Hours",2022-03-22T17:38:08Z,CT State Department of Education
jGKxl1wgiHg,CT-SEDS IEP Preview Series - Session 3: Prior Written Notice (3/21/22),2022-03-22T13:50:44Z,CT State Department of Education
XdQjYz_49Jo,CT-SEDS IEP Preview Series - Session 2: PPT Record of Meeting and Meeting Summary (3/14/22),2022-03-22T13:44:35Z,CT State Department of Education
UxHu0l7QTRU,Interagency Council for Ending the Achievement Gap - 3/11/22,2022-03-12T08:13:44Z,CT State Department of Education
7bngoW67nw8,CT-SEDS IEP Preview Series - Session 1: Notice of PPT Meeting (3/7/22),2022-03-11T14:41:51Z,CT State Department of Education
B0yOJNC7kUk,CT SAT - Getting Ready for Testing,2022-03-09T20:59:07Z,CT State Department of Education
ywNjg9KWZ-I,"State Board of Education Meeting,  3/2/22",2022-03-03T06:40:00Z,CT State Department of Education
I0arzMFHHIQ,Understanding and Interpreting Monthly Attendance Data for 2021-22,2022-03-02T13:36:08Z,CT State Department of Education
Gxd7daC3ulg,RSCO - Ana Grace Academy of the Arts,2022-03-01T03:33:40Z,CT State Department of Education
jnk1VYwFEoo,RSCO - Academy of Computer Science & Engineering video,2022-02-26T01:15:18Z,CT State Department of Education
-Nf6ddRFt6A,RSCO - Betances STEM Magnet School,2022-02-26T00:33:49Z,CT State Department of Education
DrbrYkzJ0Ts,RSCO Open Choice Explainer Video,2022-02-26T00:10:46Z,CT State Department of Education
snu6ZVN5RQg,Increasing Student Engagement,2022-02-25T16:13:12Z,CT State Department of Education
1H3paMRJq-Q,Connecticut Standards for Remote Learning Grades 9-12,2022-02-22T20:31:27Z,CT State Department of Education
H9P6G3aQcZk,CT SAT Setting Accommodations in TIDE,2022-02-15T20:58:02Z,CT State Department of Education
tQFT4eKpTMQ,CSDE and Apex Learning in 90 seconds,2022-02-15T20:53:21Z,CT State Department of Education
BHUdFcaDMbM,CSDE and Defined Learning in 120 seconds,2022-02-15T20:53:10Z,CT State Department of Education
RtTYmBBro38,Connecticut Remote Learning Commission - 2/14/22,2022-02-15T07:34:07Z,CT State Department of Education
W7RBBI35CH8,RSCO Open Choice Video SPANISH,2022-02-14T22:16:24Z,CT State Department of Education
gtWYk64l8rA,CT SAT TIDE Training,2022-02-14T17:00:52Z,CT State Department of Education
4NgDkL9Qt3Y,RSCO Open Choice Sizzle Video,2022-02-11T00:09:57Z,CT State Department of Education
cgrtIBxVaRQ,RSCO School Choice Applications are Now Open - Spanish,2022-02-10T20:04:28Z,CT State Department of Education
ER0CBV5xiI4,RSCO School Choice Applications are Now Open,2022-02-09T19:28:42Z,CT State Department of Education
SxqD_a_TwPc,"State Board of Education Meeting,  2/2/22",2022-02-02T19:39:53Z,CT State Department of Education
VDdJhoX3fFY,2021 22 District Administrators General Summative Test Administration,2022-01-26T19:41:52Z,CT State Department of Education
0i3CbO1jCYU,2021-22 District Administrators Special Populations Training,2022-01-26T19:32:02Z,CT State Department of Education
FAO0TH3E0ok,Connecticut Remote Learning Commission - 1/25/22,2022-01-26T09:11:43Z,CT State Department of Education
hLRfp3nqeZU,RSCO Virtual Fair Welcome - Spanish,2022-01-21T23:10:11Z,CT State Department of Education
Vi2euHjMe78,RSCO Virtual Fair Welcome - English,2022-01-21T23:06:25Z,CT State Department of Education
rAyxss_PnAM,"State Board of Education Meeting,  January 19, 2022",2022-01-20T06:09:18Z,CT State Department of Education
bchSVT5l5Qs,RSCO - Kinsella Magnet School of the Performing Arts,2022-01-19T00:52:18Z,CT State Department of Education
31hOFJBAwAA,RSCO - Great Path Academy,2022-01-15T02:06:05Z,CT State Department of Education
rX7Q95huTtY,Staying in School Safely During COVID-19:An Evening with CT Medical Experts for Parents and Families,2022-01-14T15:33:44Z,CT State Department of Education
h1npZNfmCZg,Reading Leadership Implementation Council - 1/13/22,2022-01-14T08:19:04Z,CT State Department of Education
DY504z1MtYc,Connecticut Remote Learning Commission - 1/10/22,2022-01-11T07:36:13Z,CT State Department of Education
Mp4cCi4za3I,RSCO - Breakthrough Magnet School South,2022-01-07T16:59:14Z,CT State Department of Education
oBwInR-R_As,RSCO - Montessori Magnet Batchelder School,2022-01-05T23:17:46Z,CT State Department of Education
rwpUtnIEE1I,RSCO - Connecticut Technical High School Systems,2022-01-05T23:09:39Z,CT State Department of Education
9bvwkoamokc,RSCO - Magnet Schools Advantage,2022-01-05T23:02:06Z,CT State Department of Education
4bk4Tmtwc-w,RSCO - Hartford Magnet Trinity College Academy,2022-01-05T22:55:44Z,CT State Department of Education
9QtW1ij6URg,RSCO - Noah Webster Microsociety Magnet,2022-01-05T22:48:19Z,CT State Department of Education
xsB-AdwVonI,RSCO - Connecticut River Academy,2022-01-05T21:37:28Z,CT State Department of Education
lLSBUmeOg8E,RSCO - Riverside Magnet School,2022-01-05T21:30:16Z,CT State Department of Education
FWsP5KWM8dg,RSCO - Betances STEM magnet school,2022-01-05T21:24:21Z,CT State Department of Education
14kmlNzN66U,RSCO - School Choice Testimonials,2022-01-05T21:19:33Z,CT State Department of Education
5A21nag7xOI,RSCO School Choice - Connecticut International Baccalaureate Academy (CIBA),2022-01-05T21:12:40Z,CT State Department of Education
-eJUeM7Sn34,RSCO School Choice - Technical High Schools,2022-01-05T21:05:44Z,CT State Department of Education
-QDdbSsANa0,RSCO School Choice - Technical High Schools - SPANISH,2022-01-05T21:03:20Z,CT State Department of Education
tSFTT5YGOPM,RSCO School Choice Residents Outside of Harford - Spanish,2021-12-20T20:56:25Z,CT State Department of Education
Xf1CpzXDU30,RSCO School Choice Residents outside of Hartford - English,2021-12-20T20:51:35Z,CT State Department of Education
EhD9UEGwZBA,RSCO School Choice Hartford Residents - Spanish,2021-12-20T20:45:27Z,CT State Department of Education
mVXJ83UulnE,RSCO School Choice Hartford Residents - English,2021-12-20T20:40:51Z,CT State Department of Education
mpCOWUot71k,RSCO Attend In-Person & Virtual Events - Spanish,2021-12-20T20:33:57Z,CT State Department of Education
GVezo-9lR5I,RSCO Attend In-Person & Virutal Events!,2021-12-20T20:27:52Z,CT State Department of Education
M96pIprVLVY,RSCO Applications Now Open - Spanish,2021-12-20T20:16:13Z,CT State Department of Education
s7JA7yr7Ys8,RSCO Applications Now Open - English,2021-12-20T20:13:09Z,CT State Department of Education
L7ETEktqvcI,RSCO Application Guidebook   Editing,2021-12-17T23:53:35Z,CT State Department of Education
VkvPS7Nilwc,RSCO Application Guidebook Step 1,2021-12-17T23:51:55Z,CT State Department of Education
UbMbOhAmI4Q,RSCO Application Guidebook Step 2,2021-12-17T23:50:51Z,CT State Department of Education
nkRy8gfcHDA,RSCO Application Guidebook Step 3,2021-12-17T23:48:13Z,CT State Department of Education
UTDxsY2Wuuc,RSCO Application Guidebook Step 4,2021-12-17T23:45:22Z,CT State Department of Education
GRAKkv__KsU,RSCO Application Guidebook Step 5,2021-12-17T23:38:32Z,CT State Department of Education
yVW0c4riPmk,RSCO Application Guidebook Extra Information,2021-12-17T23:36:00Z,CT State Department of Education
3MFygWDdPNg,CT Perkins V Comprehensive Local Needs Assessment (CLNA) Update 2021-22,2021-12-17T16:20:39Z,CT State Department of Education
Acc40gu42f4,"State Board of Education Accountability and Support Committee, December 16, 2021",2021-12-17T09:10:29Z,CT State Department of Education
J5aIMQ7THZg,"Interagency Council for Ending the Achievement Gap - December 15, 2021",2021-12-16T07:45:42Z,CT State Department of Education
Yo_pTyH1lTk,Fund For Teachers Pop Up PD,2021-12-15T15:52:48Z,CT State Department of Education
46pQm8IY638,"State Board of Education Legislation and Policy Development Committee, December 14, 2021",2021-12-15T08:44:18Z,CT State Department of Education
3jHB6705gvs,CT SAT Accommodations and TIDE,2021-12-07T17:51:35Z,CT State Department of Education
z3iEjDEl4ks,"Virtual CT School Discipline Collaborative on November 18, 2021",2021-12-02T14:33:30Z,CT State Department of Education
tVwKWLiAlE4,Connecticut Remote Learning Commission - 11/22/21,2021-11-23T08:04:48Z,CT State Department of Education
GVFn4Imk6Og,Attendance and Engagement Community of Practice,2021-11-22T20:49:43Z,CT State Department of Education
HKNY7JwtVk0,Role of the Tech Coordinator,2021-11-17T21:14:00Z,CT State Department of Education
JuNZ2nPo8vA,Introduction to Voice4Change,2021-11-15T14:10:49Z,CT State Department of Education
_dIzIoe4FqQ,Trauma and Diverse Student Populations: Cultural Considerations,2021-11-10T14:12:12Z,CT State Department of Education
eCp5D0nyfik,CT SAT Accommodations and College Board's SSD,2021-11-09T14:29:13Z,CT State Department of Education
3nCt0GVezTc,2022 CT SAT School Day Digital Testing Webinar Series,2021-11-05T13:25:11Z,CT State Department of Education
cQAPbxfTNXc,English Learner Assessment Coordinator (ELAC) Training,2021-10-28T14:56:33Z,CT State Department of Education
AY3FRedfyKY,CSDE Fall 2021 Message,2021-09-30T16:22:25Z,CT State Department of Education
AJZ3BbPLenc,Connecticut Remote Learning Commission - 9/27/21,2021-09-28T06:36:57Z,CT State Department of Education
c0d0OOK8lEM,"Attendance & Engagement System of Support & Professional Communities:  - Sep 16, 2021",2021-09-24T14:17:27Z,CT State Department of Education
CcJ7tXmxfDY,"State Board of Education Accountability and Support Meeting - September 22, 2021",2021-09-23T17:38:37Z,CT State Department of Education
P5bQ2bNCoGM,"Interagency Council for Ending the Achievement Gap - September 22, 2021",2021-09-23T07:11:13Z,CT State Department of Education
druxlFX9cCc,CSDE Fall 2021,2021-09-21T13:19:08Z,CT State Department of Education
3rPv7Kava98,2022 CT SAT Digital Test Overview,2021-09-16T14:50:08Z,CT State Department of Education
YfRZsAj5Gp0,Virtual House Call for Parents and Families: Returning to School Safely During COVID-19,2021-08-24T10:07:06Z,CT State Department of Education
2h1Ekla-mMA,Integrating Smarter Balanced and NGSS Interim Assessments into Practice,2021-08-17T17:01:58Z,CT State Department of Education
XlxkovG3nYs,Smarter Balanced and NGSS Interim Scoring and Reporting,2021-08-17T15:06:46Z,CT State Department of Education
p-9sDN2BWEY,2021 Post-School Outcomes Survey Instructional Video,2021-08-17T14:27:26Z,CT State Department of Education
P1LRwebeQx8,Encuesta de resultados después de la escuela,2021-08-17T14:09:30Z,CT State Department of Education
WNuJUj1Dh0I,Smarter Balanced and NGSS Interim Assessment Content,2021-08-17T13:37:42Z,CT State Department of Education
nix52f_NTgw,SBAC and NGSS Interim Assessments Overview,2021-08-17T13:17:25Z,CT State Department of Education
_S1i46qseh8,Using Smarter Balanced and NGSS Interim Assessments Training Session Part 2,2021-08-03T17:57:51Z,CT State Department of Education
cxLr1-CRYS4,Spark Innovation Webinar Series: Building Safe & Healthy Schools,2021-07-29T18:19:59Z,CT State Department of Education
5V0kwPU1Gdc,Spark Innovation Webinar Series: Serving the unique needs of high-school students,2021-07-28T13:28:24Z,CT State Department of Education
3InPpyrIUoU,Commissioner's Roundtable for Family and Community Engagement in Education,2021-07-27T14:07:46Z,CT State Department of Education
YxLqY11P-Ko,"Spark Innovation Webinar Series: Prioritizing Social, Emotional, & Mental Health of Students &Staff",2021-07-22T19:50:38Z,CT State Department of Education
jxqmRmE3irQ,Spark Innovation Webinar Series: Preparing & Supporting our Educator Workforce,2021-07-20T19:20:12Z,CT State Department of Education
HsyYCMy87n0,"Interagency Council for Ending the Achievement Gap - July 19, 2021",2021-07-20T07:11:22Z,CT State Department of Education
zM9wqkpA9Z0,Spark Innovation Webinar Series: Engaging Families to Support Student Learning,2021-07-15T17:36:09Z,CT State Department of Education
iTcliltOXgY,Spark Innovation Webinar Series: Focusing on Attendance & Engagement in the New Normal,2021-07-15T14:48:29Z,CT State Department of Education
J_uQPNJs0Io,Spark Innovation Webinar Series: Expanding & Amplifying Equity through ESSER II and ARP ESSER,2021-07-08T18:44:53Z,CT State Department of Education
dJl6YK0ge6k,Spark Innovation Webinar Series: Creating the Road to Success for Students in the Classroom,2021-07-06T17:19:50Z,CT State Department of Education
r5Ys89Jqvpc,Using Smarter Balanced and NGSS Interim Assessments Training Sessions,2021-06-28T14:54:07Z,CT State Department of Education
C97TALY09_U,AccelerateCT summerct.org,2021-06-28T14:53:54Z,CT State Department of Education
ODcOYKM8PaA,AccelerateCT CSDE TV Español,2021-06-28T14:53:15Z,CT State Department of Education
H7hZqN2UIrs,AccelerateCT summerct.org Español,2021-06-28T14:51:40Z,CT State Department of Education
WjPyWouzD2c,AccelerateCT Summer Camps,2021-06-28T14:50:31Z,CT State Department of Education
MaYoEHNkgyw,CT Future of Tech Commission Town Hall: Advancing Innovations in Education,2021-06-23T07:25:29Z,CT State Department of Education
YR2W7vCt3Sw,"Talk Tuesdays - Student Attendance, Engagement and Support - June 15, 2021",2021-06-18T16:05:03Z,CT State Department of Education
N3ygTpQoPhI,"Title 1, Section 1003 School Improvement Grant Cohort 2 Informational webinar",2021-06-16T12:05:25Z,CT State Department of Education
j9qGtskbGRg,Evidence Based Practices and Interventions,2021-06-16T12:04:59Z,CT State Department of Education
06FaQwH9TgM,"State Board of Education Academic Standards and Assessment Committee - June 8, 2021",2021-06-09T03:06:10Z,CT State Department of Education
Z5qBM2lsgpE,Step 5 Needs Assessment Toolkit,2021-06-08T16:25:53Z,CT State Department of Education
PQs6-Mug6U8,Step 4 Needs Assessment Toolkit,2021-06-08T16:25:14Z,CT State Department of Education
8HYHuJcotw4,Step 3 Needs Assessment Toolkit,2021-06-08T16:24:34Z,CT State Department of Education
PeRjmXnJIS4,Step 2 Needs Assessment Toolkit,2021-06-08T16:22:38Z,CT State Department of Education
HoCVqHdu5mM,Step 1 Needs Assessment Toolkit,2021-06-08T16:22:10Z,CT State Department of Education
wNOeRFt_PK0,Introduction for Needs Assessment Toolkit,2021-06-08T16:21:46Z,CT State Department of Education
HgRIJ1570Jw,Overview of Office of Higher Education Alternate Route to Certification (OHE ARC) Program,2021-06-03T19:21:23Z,CT State Department of Education
oG6HQ-wdmDM,"State Board of Education Meeting,  June 2, 2021",2021-06-03T04:48:48Z,CT State Department of Education
bOyOZMJ5Lvc,"Office Hours for 2021 Assessments - May 27, 2021",2021-05-28T15:33:43Z,CT State Department of Education
_IOmfwT4hW8,CT ARP ESSER Public Forum 5-21-21 Video 2 - Breakout Room 1,2021-05-28T12:54:12Z,CT State Department of Education
19D6C_mxow0,CT ARP ESSER Public Forum 5-20-21 Video 4 - Breakout Room 3,2021-05-28T12:54:11Z,CT State Department of Education
35IWhclWJEs,CT ARP ESSER Public Forum 5-20-21 Video 3 - Breakout Room 2,2021-05-28T12:54:11Z,CT State Department of Education
7XP9RlZ6Gas,CT ARP ESSER Public Forum 5-20-21 Video 2 - Breakout Room 1,2021-05-28T12:54:11Z,CT State Department of Education
ASCY8E3abBA,CT ARP ESSER Public Forum 5-21-21 Video 3 - Breakout Room 2,2021-05-28T12:54:11Z,CT State Department of Education
HoOpojWCsZ8,CT ARP ESSER Public Forum 5-21-21 Video 5 - Breakout Room 4,2021-05-28T12:54:11Z,CT State Department of Education
LMHFwElEm08,CT ARP ESSER Public Forum 5-20-21 Video 1 - Main Room,2021-05-28T12:54:11Z,CT State Department of Education
O3PmhHE42_A,CT ARP ESSER Public Forum 5-21-21 Video 4 - Breakout Room 3,2021-05-28T12:54:11Z,CT State Department of Education
uXYh8O22llQ,CT ARP ESSER Public Forum 5-21-21 Video 1 - Main Room,2021-05-28T12:54:11Z,CT State Department of Education
2d-XFDAF7s0,Veteran Benefits in Higher Education,2021-05-27T15:35:35Z,CT State Department of Education
Fl1DyOaqRS4,"Educator Evaluation and Support 2022 Council Meeting - May 25, 2021",2021-05-26T18:33:06Z,CT State Department of Education
P8SOjum7p3k,Implementing Defined Learning Digital Resource in District,2021-05-26T16:28:33Z,CT State Department of Education
-4uglyyXTR8,"CSDE/RESC District Planning Sessions for CT-SEDS Implementation (May 25, 27 and June 2, 2021)",2021-05-26T16:05:46Z,CT State Department of Education
j3Yxdq6bDtg,Implementing Apex Learning Digital Resource in District,2021-05-25T18:17:19Z,CT State Department of Education
_KVJkP1CiTI,"Office Hours for 2021 Assessments - May 20, 2021",2021-05-24T13:48:20Z,CT State Department of Education
i1TSd6t_x2o,"State Board of Education Special Meeting, May 19, 2021",2021-05-20T02:28:50Z,CT State Department of Education
bl75FSkS_lA,"State Board of Education Accountability and Support Committee, May 18, 2021",2021-05-19T08:13:59Z,CT State Department of Education
LaW9S6ieZro,Play and Learning: Considerations for Summer 2021 Preschool Programming,2021-05-17T13:51:27Z,CT State Department of Education
Q9rADM4VAg4,"Office Hours for 2021 Assessments - May 13, 2021",2021-05-14T15:53:05Z,CT State Department of Education
hzkzsZCQMoU,"Educator Evaluation and Support 2022 Council Meeting - May 11, 2021",2021-05-13T13:38:34Z,CT State Department of Education
ETRmZ1lkH5w,Save My Seat 30 Second English Video,2021-05-10T15:28:20Z,CT State Department of Education
0D7vr7ZkMjY,Save My Seat 15 Sec English Video,2021-05-10T15:23:03Z,CT State Department of Education
ujc6fKGtVkg,Reservé Mi Puesto 30 Sec Spanish Video,2021-05-10T15:18:03Z,CT State Department of Education
3qIMgq8Frxs,Reservé Mi Puesto 15 Second Spanish Video,2021-05-10T15:11:57Z,CT State Department of Education
vEVJYsMl2Oo,"Office Hours for 2021 Assessments - May 6, 2021",2021-05-07T17:19:07Z,CT State Department of Education
jw-gH6n712U,Save My Seat!,2021-05-07T14:14:39Z,CT State Department of Education
xf81nDIEUHE,"State Board of Education Meeting, May 5, 2021",2021-05-06T05:20:27Z,CT State Department of Education
p9XDI17XSSw,"Educator Evaluation and Support 2022 Council Meeting - April 9 ,2021",2021-05-04T15:37:16Z,CT State Department of Education
hAiSqDjNg60,"Educator Evaluation and Support 2022 Council Meeting - April 27, 2021",2021-05-04T15:37:12Z,CT State Department of Education
kmw7honQkzk,Considerations for Preschool to Kindergarten Transitions,2021-04-30T19:01:53Z,CT State Department of Education
haJLG7EEb50,"Office Hours for 2021 Assessments - April 29, 2021",2021-04-30T18:26:12Z,CT State Department of Education
wO67si5lDf0,"AccelerateCT Summer Program Grants Informational Webinar - April 28, 2021",2021-04-29T15:46:52Z,CT State Department of Education
a0A4EsacwJc,Computer Science Course Reporting Guidance,2021-04-28T14:06:10Z,CT State Department of Education
yDhJNog8mmI,Self-Care and Social Emotional Learning (SEL) for Parents and Caregivers,2021-04-27T18:00:40Z,CT State Department of Education
11U-MiRh9s4,"Office Hours for 2021 Assessments - April 22, 2021",2021-04-23T13:52:27Z,CT State Department of Education
k50O7w1IYWM,Adult Education Federal Grant Bidders Conference,2021-04-16T19:35:39Z,CT State Department of Education
2elKmE3GYoM,"Office Hours for 2021 Assessments - April 15, 2021",2021-04-16T19:31:54Z,CT State Department of Education
I_eK1eeo7_s,"State Board of Education Academic Standards and Assessment Committee - April 13, 2021",2021-04-14T03:02:50Z,CT State Department of Education
lxORD-j3rCU,"Office Hours for 2021 Assessments - April 8, 2021",2021-04-09T14:13:31Z,CT State Department of Education
B-qaVY57EkY,"State Board of Education Meeting, April 7, 2021",2021-04-08T04:03:53Z,CT State Department of Education
N2SYkYtCntE,"State Board of Education Legislation and Policy Development Committee, April 7, 2021",2021-04-08T01:22:13Z,CT State Department of Education
t5-F2RCAtAc,"Office Hours for 2021 Assessments April 1, 2021",2021-04-05T13:55:27Z,CT State Department of Education
ZGUgL1GfVZ0,ESSER II Application - Technical Assistance,2021-04-05T13:03:57Z,CT State Department of Education
9laxShSiLkw,Implementing African American/Black and Puerto Rican/Latino Studies in Your High Schools,2021-04-01T16:01:26Z,CT State Department of Education
2lZcwEfwBYs,"State Board of Education Retreat, March 26, 2021",2021-03-27T08:32:08Z,CT State Department of Education
GjLkAKppFTI,2021 Local School Wellness Policy Triennial Assessment - Introduction,2021-03-24T13:01:38Z,CT State Department of Education
Qr0_orooXDI,2021 Local School Wellness Policy Triennial Assessment - Video 2: Completing the WellSAT 3.0,2021-03-24T13:01:25Z,CT State Department of Education
PeZjWwmliYo,2021 Local School Wellness Policy Triennial Assessment - Video 3: Completing the WellSAT-I,2021-03-24T13:01:07Z,CT State Department of Education
qnFSKSciB88,2021 Local School Wellness Policy Triennial Assessment - Video 5: Summarizing and Sharing Findings,2021-03-24T13:00:54Z,CT State Department of Education
4YGJq6Flj40,2021 Local School Wellness Policy Triennial Assessment - Video 4: Identifying Connections,2021-03-24T13:00:40Z,CT State Department of Education
87Bpcgtl2C4,"Special Education during COVID-19: Resources, Supports and Best Practice Strategies",2021-03-19T17:48:22Z,CT State Department of Education
J6Z1Iz-b1EE,Strategies for Parents and Families to Support Academic Success during Remote Learning,2021-03-19T17:39:15Z,CT State Department of Education
IhMT6yQ7vxI,NAEP School Survey Update for CT Schools,2021-03-18T19:16:29Z,CT State Department of Education
8tgYWaHrCLQ,"Interagency Council for Ending the Achievement Gap - March 17, 2021",2021-03-18T06:58:02Z,CT State Department of Education
G_y212NCQJU,"2021 Office Hours – March 15, 2021",2021-03-17T13:09:43Z,CT State Department of Education
91KTTS6Onlo,"State Board of Education Meeting, March 3, 2021",2021-03-04T08:36:43Z,CT State Department of Education
bwuhhz52KkY,"State Board of Education Legislation and Policy Development Committee, March 3, 2021",2021-03-04T02:52:03Z,CT State Department of Education
ObMSM7MVhjo,RSCO - Two Rivers Magnet Middle School,2021-03-03T19:59:47Z,CT State Department of Education
ad_jqtUyV0E,Pandemic-Related Transitions: P-3 Learning Contexts,2021-03-03T14:53:48Z,CT State Department of Education
ncn8iJ-KKcU,Dr. Miguel Cardona's 2021 Message to CT Educational Community,2021-03-02T13:43:43Z,CT State Department of Education
4Afek6z7A1k,School Climate: Impact on Attendance,2021-03-01T18:06:12Z,CT State Department of Education
DO_jUjvZW3k,"Planning for Return to School in Fall 2021: Young Children in PreK, Kindergarten, and Grade 1",2021-02-26T14:04:14Z,CT State Department of Education
Xba0Wuyha0Y,"State Board of Education Accountability and Support Committee, February 18, 2021",2021-02-19T09:16:03Z,CT State Department of Education
N5ym4jAa9q4,Building Capacity for Technology Integration,2021-02-18T19:12:06Z,CT State Department of Education
9nPR2qP1l0k,CTEC Technical High Schools Extended March Application Date,2021-02-18T00:01:53Z,CT State Department of Education
pl8G-bvdQYw,CTEC Technical High Schools Spanish  Extended March Application Date,2021-02-17T23:55:29Z,CT State Department of Education
nrAWx5tXt3Q,RSCO Introductory Video with updated March 19 Deadline,2021-02-17T22:28:52Z,CT State Department of Education
AYulNvhlWHg,"2021 Office Hours – February 16, 2021",2021-02-17T17:36:05Z,CT State Department of Education
9T31-iwnvs0,ED166 Application,2021-02-17T16:54:19Z,CT State Department of Education
bmHLHK-4rn4,"CT SAT School Day 2021 Test Coordinator Training, February 10, 2021",2021-02-17T14:32:37Z,CT State Department of Education
RvMcpEHZ8rQ,Building Community - Promoting Collegial Relationships,2021-02-16T22:18:58Z,CT State Department of Education
L1MzZAn25Fs,EdSight Secure Upgrade - Introductory Webinar on Interface Changes and Functionality,2021-02-16T19:00:36Z,CT State Department of Education
FFvJV0l8rJs,Supporting Undocumented Students to Apply for Financial Aid,2021-02-11T15:36:42Z,CT State Department of Education
jPgTekm8Cbo,"LAS Links Office Hours - January 27, 2021",2021-02-11T15:26:01Z,CT State Department of Education
gF721sV5k9U,Science Education in CT: Two Districts Successes During the Pandemic,2021-02-11T14:57:33Z,CT State Department of Education
CZIXrt5p8Oo,"Academic Standards and Assessment Committee, February 9, 2021",2021-02-10T03:45:01Z,CT State Department of Education
1WkIY6TbVcM,RSCO  CTEC Technical High Schools - El plazo de solicitud es el 28 de febrero,2021-02-09T22:15:45Z,CT State Department of Education
G66F6n2Btfw,RSCO Social   CTEC Technical High School Feb 28th application date,2021-02-09T15:27:11Z,CT State Department of Education
xK9eE_kIb50,Formative Assessment Practices  From the Classroom to Remote Learning,2021-02-04T16:59:51Z,CT State Department of Education
jel5XJ-iWGg,"POP UP Professional Development Session 2   Building Community   Forming Connections, Community, and",2021-02-04T16:55:18Z,CT State Department of Education
tDFdQnQYGg8,"State Board of Education Meeting, February 3, 2021",2021-02-04T05:48:49Z,CT State Department of Education
_Of5MI6imUQ,"State Board of Education Legislation and Policy Development Committee, February 3, 2021",2021-02-04T02:00:50Z,CT State Department of Education
zVScnm8JS8o,Video 3 CSDE Spanish Subtitles,2021-02-02T18:47:03Z,CT State Department of Education
_q3TvMO3w7s,CSDE Video 3 English Subtitles,2021-02-02T18:46:46Z,CT State Department of Education
VLZee0l0Nuk,CSDE Video 2 English Subtitles,2021-02-01T16:58:59Z,CT State Department of Education
51PaAc26bqg,CSDE Video 2 Spanish Subtitles,2021-02-01T16:58:37Z,CT State Department of Education
sOUk3Y6K8A8,CSDE Video 1 Students' Voices w Spanish Subtitles,2021-02-01T16:34:56Z,CT State Department of Education
nGwHoq4PN1o,CSDE Video 1 Students' Voices w English Subtitles,2021-02-01T16:31:09Z,CT State Department of Education
U_xQPqBt_Sc,English Learners in Connecticut’s Charter Schools,2021-01-29T19:13:42Z,CT State Department of Education
SbC1Dwk4wTg,"CSDE Educator Diversity Coaching Series, Session 2",2021-01-25T19:15:03Z,CT State Department of Education
cQunGNGA7JI,2021 Assessment Training  Special Populations,2021-01-25T17:10:19Z,CT State Department of Education
wgqMC3Y04pw,2021 Assessment Training  General Test Administration Policies,2021-01-25T16:56:12Z,CT State Department of Education
tdKWvMlOT3Y,"Making Sound Placement Decisions for Children with Disabilities, Ages 3-5",2021-01-22T17:13:55Z,CT State Department of Education
iuqAEO2Qdbs,"State Board of Education Accountability and Support Committee, January 19, 2021",2021-01-20T09:20:27Z,CT State Department of Education
yzfAndxp-Tg,RSCO - Explore Las Opciones Escolares,2021-01-19T17:21:07Z,CT State Department of Education
ADRcyZLUGqY,RSCO  CTEC Actúe AHORA para solicitar un cupo en 1 de 3 escuelas secundarias técnicas,2021-01-19T17:12:30Z,CT State Department of Education
Nz6VQTWNgF0,Civic Leadership  School Overview - RSCA,2021-01-15T23:00:04Z,CT State Department of Education
CwF17CZ1JiE,RSCO - CTEC Technical High Schools EARLY APPLICATION DEADLINE,2021-01-15T18:31:22Z,CT State Department of Education
ovYW4KQGiyo,CTRA   Connecticut River Academy Short Overview - RSCA,2021-01-15T15:00:32Z,CT State Department of Education
nzz3oejmHfA,"RSCO School Program Options - Magnet, Open Choice, Technical",2021-01-14T22:28:11Z,CT State Department of Education
Q2l6Ns_e-lc,Capital Prep School - Short Overview - RSCO,2021-01-14T16:00:08Z,CT State Department of Education
T16Uoywldro,Pioneering Innovative Arts and Learning in Challenging Times - Teaching Music Composition Using Tech,2021-01-14T14:28:00Z,CT State Department of Education
hkGnhhk6IoQ,Instructional Practices  From In Person to Remote Learning - Part 2,2021-01-14T14:15:47Z,CT State Department of Education
IVK6LTMmxHk,Instructional Practice  From In Person to Remote Learning - Part 1,2021-01-14T14:15:23Z,CT State Department of Education
BvNqExg1wEk,Principals Instructional Strategies  From In Person to Remote Learning 1,2021-01-14T14:15:09Z,CT State Department of Education
HWAIDhNBNK0,"State Board of Education Meeting, January 13, 2021",2021-01-14T05:24:55Z,CT State Department of Education
cgm_fMgiNqM,"State Board of Education Legislation and Policy Development Committee, January 13, 2021",2021-01-14T02:25:29Z,CT State Department of Education
kfBrjdLINtc,LAS Links Office Hours,2021-01-13T20:36:12Z,CT State Department of Education
sPikm78-fg8,Classical Magnet School - Short Overview - RSCO,2021-01-13T15:54:27Z,CT State Department of Education
-DrR-W3s_wQ,"RSCO School Program Options - Magnet, Open Choice, Technical",2021-01-13T15:42:07Z,CT State Department of Education
_Bb5B39AXFM,CTRA - Connecticut River Academy Overview - RSCO,2021-01-13T15:29:00Z,CT State Department of Education
KXi2b3zqPBw,Civic Leadership - School Overview  RSCO,2021-01-12T22:36:09Z,CT State Department of Education
YmT0ZmFUTOs,Capital Prep School Overview - RSCO,2021-01-12T18:49:20Z,CT State Department of Education
JLZPaUFXhf0,Classical Magnet  School Highlights - RSCO,2021-01-11T19:02:23Z,CT State Department of Education
84T8pgzfKxM,RSCO Introductory Video - Spanish - el poder de la  elección de escuela,2021-01-08T22:01:25Z,CT State Department of Education
6aK67-6UExw,RSCO Introductory Video for the School Choice Program,2021-01-08T21:56:02Z,CT State Department of Education
oxLJjEIG2D0,How to support your children working remotely: a webinar for parents with CSDE and Commonsense Media,2020-12-21T18:51:38Z,CT State Department of Education
cdkueC9XYXw,The Role of Welcome Centers in Supporting English Learners,2020-12-18T16:21:41Z,CT State Department of Education
pX1B4CBItkA,FAFSA Prospective Applicant Webinar,2020-12-17T13:50:17Z,CT State Department of Education
Dl2RFNqHTWY,State Board of Education Accountability and Support Committee Meeting,2020-12-16T09:39:31Z,CT State Department of Education
bv5yMQl1CXE,"Interagency Council for Ending the Achievement Gap - December 10, 2020",2020-12-11T07:54:18Z,CT State Department of Education
8G_y-0h9BoY,Lt. Gov. Bysiewicz Launching 2nd COVID-19 Computing Challenge for 3-12 Graders,2020-12-09T23:29:55Z,CT State Department of Education
AUZw3ke9FGk,How To Get Assistance With The Application Process - RSCO Virtual Fair Platform,2020-12-09T23:29:50Z,CT State Department of Education
akkH_eCL4MY,RSCO   Magnet Schools - RSCO Virtual Fair Platform,2020-12-04T23:25:15Z,CT State Department of Education
PLMco7GDyfY,RSCO   Program Options Explainer - RSCO Virtual Fair Platform,2020-12-04T21:00:57Z,CT State Department of Education
FUIpNU5uxhY,Guidebook Step 5 - RSCO Virtual Fair Platform,2020-12-03T22:00:17Z,CT State Department of Education
ASiIp24a1bg,Guidebook Step 4 - RSCO Virtual Fair Platform,2020-12-03T21:58:21Z,CT State Department of Education
aSZykqShwXs,Guidebook Step 3 - RSCO Virtual Fair Platform,2020-12-03T21:55:13Z,CT State Department of Education
33JXHb_uUqA,Guidebook Step 2 - RSCO Virtual Fair Platform,2020-12-03T21:52:18Z,CT State Department of Education
RhbgXpIxHeQ,Guidebook Step 1 - RSCO Virtual Fair Platform,2020-12-03T21:45:24Z,CT State Department of Education
bda97R9jK78,Guidebook to Editing and Resubmitting an Application - RSCO Virtual Fair Platform,2020-12-03T21:43:07Z,CT State Department of Education
3nobQYgITWg,RSCO Introductory Video - RSCO Virtual Fair Platform,2020-12-03T20:59:18Z,CT State Department of Education
dcXUMc4p5rg,"State Board of Education Meeting, Dec. 2, 2020",2020-12-03T06:32:44Z,CT State Department of Education
kJM_RlAhw34,State Board of Education Legislation and Policy Development Committee,2020-12-03T02:14:30Z,CT State Department of Education
LHfToWalJ0c,Instruction and Assessment Cycle,2020-12-02T20:46:46Z,CT State Department of Education
AgS8xP6DDHU,Student Learning Objectives,2020-11-30T17:04:00Z,CT State Department of Education
PtMmK6TzTPM,"We can’t let our guard down Connecticut. Together, we got this!",2020-11-23T20:07:32Z,CT State Department of Education
3fk4GIATVhc,We're doing this for them - CT's Students and Teachers!,2020-11-21T16:36:41Z,CT State Department of Education
SIhlFgeQ_Fw,Changing Demographics of Connecticut’s English Learners: Digging into the New Data Bulletin,2020-11-20T16:51:19Z,CT State Department of Education
oD3HqQVJjR8,State Board of Education Accountability and Support Committee Meeting,2020-11-20T09:33:13Z,CT State Department of Education
yHYFjSSzsDE,National Blue Ribbon Schools,2020-11-17T13:12:01Z,CT State Department of Education
rr34YaJ229Y,State Board of Education Academic Standards and Assessment Committee Meeting,2020-11-17T04:19:46Z,CT State Department of Education
Aj8xvqhwOSA,State Board of Education Legislation and Policy Development Committee,2020-11-14T04:23:56Z,CT State Department of Education
fvQlRjZ9geE,Cov-Ed - Learning Goes Viral,2020-11-13T20:12:54Z,CT State Department of Education
E5boSkUsLn0,Governor Lamont on Computer Science Education,2020-11-12T18:34:01Z,CT State Department of Education
R69n4vPuX2U,CT Foundations of Reading Survey Webinar,2020-11-12T18:33:46Z,CT State Department of Education
cgsLXUn12L4,Secondary Transition Discussion with CT State Agencies,2020-11-06T15:10:55Z,CT State Department of Education
-Z2DvgQXUoY,CT SAT School Day Spring 2021 Updates,2020-11-06T15:05:44Z,CT State Department of Education
zz81SwAcuRE,"EdSight Postsecondary Deep Dive, version 2",2020-11-06T14:38:55Z,CT State Department of Education
6ulEV3MSaqQ,"State Board of Education Meeting - November 4, 2020",2020-11-05T12:26:35Z,CT State Department of Education
DbEwLjiNLTg,State Board of Education Legislation and Policy Development Committee,2020-11-05T09:43:31Z,CT State Department of Education
Gwin-gc64RM,Virtual Mentoring as a Tool to Improve Student Engagement in Remote and Hybrid Learning Models,2020-11-04T18:01:16Z,CT State Department of Education
sDmr7xHj6xY,"Interagency Council for Ending the Achievement Gap - October 30, 2020",2020-10-31T07:02:51Z,CT State Department of Education
4XlKzuidqJ4,Updates on the Connecticut Physical Fitness Assessment CPFA and Best Practices on Administering the,2020-10-30T13:37:44Z,CT State Department of Education
CN6KktG7zX4,Addressing the Needs of Dually Identified Students through IEPs and Instructional Supports,2020-10-23T18:54:32Z,CT State Department of Education
QJdsI0YazFY,Assessment and Accountability in 2020-21,2020-10-22T19:56:32Z,CT State Department of Education
f46DvnV9OdQ,Flexibilities for Implementing the Guidelines for Educator Evaluation 2017 for 2020-21,2020-10-21T18:13:31Z,CT State Department of Education
JGgC_8Yig9M,State Board of Education Accountability and Support Committee Meeting,2020-10-21T07:50:16Z,CT State Department of Education
z_QPLgSECh0,Highlighting Municipal Childcare Programs to Support School Families,2020-10-16T14:06:25Z,CT State Department of Education
XEymB6m4e4U,EdSight Postsecondary Deep Dive,2020-10-16T13:43:24Z,CT State Department of Education
ZWJj5sUt72k,Early Childhood Environments During the COVID-19 Health Emergency,2020-10-13T15:58:37Z,CT State Department of Education
JxOef-t9xCA,CHFA Teachers Mortgage Assistance Program,2020-10-08T13:54:19Z,CT State Department of Education
GySdmM9oaoQ,State Board of Education Meeting,2020-10-08T04:47:02Z,CT State Department of Education
bwZ3Wq2Qp_0,State Board of Education Legislation and Policy Development Committee,2020-10-07T13:30:13Z,CT State Department of Education
yGbKw7-tjn8,Town Hall Panel Discussion Reopening Guidance School Nutrition #7,2020-10-02T17:16:15Z,CT State Department of Education
1NhLkZ--qVA,CT MFG DAY KICKOFF,2020-10-02T15:51:13Z,CT State Department of Education
qyU4dXuL4qA,Social Emotional Learning SEL 101: Initial steps to building a solid foundation for SEL,2020-10-01T17:14:35Z,CT State Department of Education
9otcylTl4g0,Successfully Navigating FAFSA Completion in a COVID Environment,2020-10-01T16:48:30Z,CT State Department of Education
t_fkvLM5kTU,Town Hall Panel Discussion Re opening Guidance School Nutrition #6,2020-09-25T17:35:09Z,CT State Department of Education
wqMIXVPmHQw,EIT for Teachers,2020-09-23T15:09:58Z,CT State Department of Education
CC9EiCpPLzE,Town Hall Panel Discussion Re opening Guidance School Nutrition #5,2020-09-21T13:52:30Z,CT State Department of Education
JsqCZmv7VNs,State Board of Education Accountability and Support Committee Meeting,2020-09-18T08:06:19Z,CT State Department of Education
1dU7P3xIQGQ,"COVID-19 and Schools - Case Management, Testing, and Assisting with Contact Tracing",2020-09-17T15:58:54Z,CT State Department of Education
uU8s0PhuST4,"State Board of Education Finance, Audit, and Budget Committee Meeting",2020-09-16T02:34:50Z,CT State Department of Education
-QOZ8OemuKg,State Board of Education Academic Standards and Assessment Committee Meeting,2020-09-15T03:13:37Z,CT State Department of Education
3Wcw4CSaFb4,Town Hall Panel Discussion Re opening Guidance School Nutrition #4,2020-09-14T17:43:52Z,CT State Department of Education
Lj42jWlcPes,Learning Model and Enrollment Data Collection,2020-09-14T17:37:01Z,CT State Department of Education
402XvE04_S0,Early Childhood Outcomes - User Training Webinar (2020),2020-09-11T15:27:31Z,CT State Department of Education
-U66v4p_LZQ,"COVID-19 and Schools: Case Management, Testing, and Assisting with Contact Tracing",2020-09-08T20:03:25Z,CT State Department of Education
O_u5Op1IQtM,Town Hall Panel Discussion Re opening Guidance School Nutrition #3,2020-09-04T15:04:42Z,CT State Department of Education
aIJ-FH5Flzs,State Board of Education Meeting,2020-09-03T03:39:50Z,CT State Department of Education
AaF66E76yks,State Board of Education Legislation and Policy Development Committee,2020-09-03T01:32:35Z,CT State Department of Education
brie9COTc-A,Town Hall Panel Discussion Re opening Guidance School Nutrition #2,2020-09-02T16:57:28Z,CT State Department of Education
yT3WyEVfAA4,Town Hall Panel Discussion Reopening Guidance School Nutrition #1,2020-09-02T16:19:50Z,CT State Department of Education
ovd1u-95yxE,"CT State Board of Education Special Meeting - August 11, 2020",2020-08-27T20:48:25Z,CT State Department of Education
HZ2k6VcB5kw,Preparing School Water Systems for Fall Reopening,2020-08-27T14:08:00Z,CT State Department of Education
eG6SOHMHxHg,"COVID-19 and Schools: Mitigation Strategies, Community Spread, and Decision Making",2020-08-20T17:45:20Z,CT State Department of Education
O3DIrCm8pis,Virtual House Call for Parents and Families: Return to School Safely During COVID-19,2020-08-19T13:56:43Z,CT State Department of Education
r4uYmKF8JD8,Connecticut PK-12 Exception Review Panel,2020-08-18T19:23:48Z,CT State Department of Education
jP_NDXt8lOs,Beginning with a Unit Designed for Success,2020-08-12T20:00:09Z,CT State Department of Education
Rr0cKFUokk4,Building Community,2020-08-12T19:57:27Z,CT State Department of Education
kwL0gK4AtxY,Overview - Sensible Assessment Practices 2020-21 and Beyond Webinar Series,2020-08-12T19:53:17Z,CT State Department of Education
Egx44s0-Alw,Start of the School Year,2020-08-12T19:48:25Z,CT State Department of Education
qtlqAmKjGLc,"Adapt, Advance, Achieve - Virtual Training: Cleaning & Disinfection Strategies for School Reopening",2020-08-05T17:46:16Z,CT State Department of Education
S-MD8GwztCg,"Adapt, Advance, Achieve: Virtual Training Opportunity on Optimizing Ventilation for School Reopening",2020-08-04T15:19:51Z,CT State Department of Education
J4F14iixee4,Mi Experiencia Educativa en el tiempo de Covid 19,2020-07-24T13:01:51Z,CT State Department of Education
0mMrd3z_Dag,Self-Care for School-Based Mental Health Providers (MHP) During COVID-19,2020-07-24T12:46:17Z,CT State Department of Education
PCxKB34uRP8,FAPE at Three - July 2020,2020-07-15T13:22:12Z,CT State Department of Education
y2v2dsF_PQc,New IEP Roll Out Plan - 5-Year Implementation Plan for Training on the New IEP and CT-SEDS,2020-07-14T17:22:38Z,CT State Department of Education
gPPnLDPKwWQ,"CT State Board of Education Meeting - July 14, 2020",2020-07-14T16:55:11Z,CT State Department of Education
Kbjzi9KhpzE,"Legislation and Policy Development Committee - CT State Board of Education - July 14, 2020",2020-07-14T13:30:55Z,CT State Department of Education
Ex5Puyk9QtE,Strategies for Schools to Provide Crisis Support to Families and Community During COVID-19,2020-07-10T21:43:01Z,CT State Department of Education
aquDz5jasuE,Flexible Staffing Strategies for Districts and LEAs,2020-07-10T16:10:17Z,CT State Department of Education
u42l8_856-8,"Reopen Plan Webinar - Adapt, Advance, Achieve: CT's Plan to Learn and Grow Together",2020-07-09T16:38:55Z,CT State Department of Education
ZA955zr7BwM,School for Critical Consciousness: Engaging Black and Latinx Youth,2020-07-02T18:53:06Z,CT State Department of Education
XuD0K6STtxw,School for Critical Consciousness: Engaging Black and Latinx Youth (For Leadership),2020-07-02T18:51:43Z,CT State Department of Education
k3_0BMFHe44,"Lt. Governor's Computing Challenge Virtual Showcase - June 30, 2020",2020-06-30T15:48:31Z,CT State Department of Education
whgjr-pMo9g,"Interagency Council for Ending the Achievement Gap - June 23, 2020",2020-06-23T18:13:16Z,CT State Department of Education
n02E_L5HE60,"CT State Board of Education Academic Standards and Assessment Committee - June 22, 2020",2020-06-22T20:32:29Z,CT State Department of Education
0P3tN1Q1DFQ,"CT State Board of Education Meeting - June 17, 2020",2020-06-17T16:01:48Z,CT State Department of Education
Nma5L2EKNRE,"CT State Board of Education - Legislation & Policy Development Committee Meeting - June 17, 2020",2020-06-17T13:42:57Z,CT State Department of Education
jzKSmvDjtXI,Take the 2020 Summer Learning Challenge!,2020-06-12T14:20:43Z,CT State Department of Education
V7hRH0QYRdA,Student Voices: Distance Learning During COVID-19 Virtual Connecticut Forum,2020-06-11T14:47:52Z,CT State Department of Education
kk8petv-FPo,Itinerant Early Childhood Special Education,2020-06-09T17:52:43Z,CT State Department of Education
Dn5ZRNVCTaQ,"Student Voice and School Climate Presentation - CT State Board of Education Meeting - June 3, 2020",2020-06-08T18:24:32Z,CT State Department of Education
DeiJ4lMMcis,Connecting and Listening to Vulnerable Families During COVID-19,2020-06-05T16:53:19Z,CT State Department of Education
UmAdIJ_zs4I,"CT State Board of Education Meeting - June 3, 2020",2020-06-03T16:37:13Z,CT State Department of Education
N4nmpb8EwPw,"Supporting Parents/Caregivers of Students w/High Needs: Science, Social Studies, and Current Events",2020-05-29T20:45:33Z,CT State Department of Education
ikt4jSqbG2Q,CSDE Educator Diversity Coaching Series Part 2,2020-05-29T13:13:26Z,CT State Department of Education
W1ii6YzL_5o,Learning at a Distance - Journeys of CT Schools - Session 7: Teaching Social Studies,2020-05-28T16:11:14Z,CT State Department of Education
xwErM9bZ1_Y,Supporting Parents/Caregivers of Students w/High Needs During COVID-19: Play & Leisure,2020-05-27T20:43:39Z,CT State Department of Education
WH9glISDQY8,LAS Links Interactive Reports Webinar,2020-05-27T18:40:58Z,CT State Department of Education
VrxWwOjhkn0,Supporting Parents/Caregivers of Students w/ High Needs During COVID-19:  Math,2020-05-22T19:50:19Z,CT State Department of Education
6JIToGdPlJM,Supporting Parents/Caregivers of Students w/ High Needs During COVID-19: Physical Activity/Mobility,2020-05-22T15:53:06Z,CT State Department of Education
bwhTwWXf5O4,Supporting Parents/Caregivers of Students w/High Needs During COVID-19: Sensory Activities & Support,2020-05-22T15:00:57Z,CT State Department of Education
USHnYmfWN3I,Supporting Parents & Caregivers of Students with High Needs During COVID-19 - Literacy,2020-05-22T14:12:31Z,CT State Department of Education
6mNUqUXvcms,Effective Engagement of Students and Families from Diverse Communities during the COVID-19 Pandemic,2020-05-22T13:20:58Z,CT State Department of Education
tNNnp5_Vsqs,Supporting Parents & Caregivers of Students with High Needs During COVID-19: Communication Skills,2020-05-21T19:50:28Z,CT State Department of Education
bBPxeUuCVbM,Supporting Parents & Caregivers of Students with High Needs During COVID-19: Art,2020-05-21T19:05:57Z,CT State Department of Education
WO3o8P3o6U8,Learning at a Distance - Journeys of CT Schools - Session 6: Today’s Skills Tomorrow’s Careers,2020-05-21T13:55:30Z,CT State Department of Education
N3EWLpTNbv8,Accountability and Support Committee - Connecticut State Board of Education,2020-05-19T16:42:25Z,CT State Department of Education
ynzkZ2GX0qI,Learning at a Distance - Journeys of CT Schools - Session 5: Teaching the Artistic Processes,2020-05-15T16:52:31Z,CT State Department of Education
l_V172s9Yfs,Best Practices for Serving English Learners,2020-05-13T19:51:33Z,CT State Department of Education
fUJSlqLIjVE,"CT State Board of Education Meeting - May 13, 2020",2020-05-13T15:47:22Z,CT State Department of Education
eDEE7_zsGrM,Supporting Parents/Caregivers of Students w/High Needs During COVID-19: Life Skills/Self-Help Skills,2020-05-12T12:07:20Z,CT State Department of Education
DpqCnn9DW2U,Learning at a Distance - Journeys of CT Schools - Session 4: Classroom in your Home - Science K-12,2020-05-12T10:10:36Z,CT State Department of Education
59G22vdv-IM,EdSight Secure Student Summary Webinar Including How to Filter Students by Days Enrolled in District,2020-05-11T15:31:51Z,CT State Department of Education
PIvCCrZFi3w,The Three Rs of Learning from Home: Tips for Stressed-out Families,2020-05-11T15:26:23Z,CT State Department of Education
ymbD_W_Vq7M,Learn-from-Home Resources for Parents/Guardians of Learners with Special Needs (Including Those with,2020-05-08T20:08:45Z,CT State Department of Education
nrw0zmMBzNE,Learning at a Distance - Journeys of CT Schools - Session 2: Focus on ELA and Math,2020-05-06T18:12:12Z,CT State Department of Education
LE-5xiyOidg,Learning at a Distance - Journeys of CT Schools - Session 3: Sustaining Academic Learning & Growth,2020-05-06T18:12:08Z,CT State Department of Education
4Tg9-p-ekg0,Connecticut SAT School Day Updates,2020-05-06T18:04:28Z,CT State Department of Education
--PQJWF6jL8,Teacher Appreciation Week,2020-05-05T22:29:36Z,CT State Department of Education
BLWnA8s2lYQ,"April 23, 2020, State Board of Education Special Meeting",2020-05-05T22:28:19Z,CT State Department of Education
INoY5WHUuTA,An Introduction to the Quantile Framework,2020-05-04T14:25:34Z,CT State Department of Education
OYxC7dirPyY,Secondary Transition Resources During the COVID-19 Pandemic,2020-05-01T19:57:32Z,CT State Department of Education
lFncEuJE_ro,An Introduction to The Lexile Framework for Reading,2020-04-30T18:51:36Z,CT State Department of Education
l2QdVaT3ISI,Remote Interim Assessment Administration and Smarter Balanced Remote Learning Resources,2020-04-29T16:24:13Z,CT State Department of Education
jY9RsRVlPmw,Learning at a Distance - Journeys of CT Schools - Session 1: Addressing the K-12 Continuum,2020-04-28T14:20:06Z,CT State Department of Education
85Z9HaDQxXI,Grief Supports for the School Community,2020-04-27T14:43:53Z,CT State Department of Education
mE_ghwIuIwM,Resources for Parents with Learners who have Special Needs,2020-04-24T17:32:27Z,CT State Department of Education
mrYiPQYTrXE,Supporting Parents/Caregivers of Students with High Needs During the COVID 19 Pandemic,2020-04-22T17:51:46Z,CT State Department of Education
Kz0nuNLQeaE,Updates for District Human Resources (HR) Staff,2020-04-21T19:36:16Z,CT State Department of Education
yBezhOLZQNI,Un mensaje de/A message from CSDE Equity & Language Director Dr. Gladys Labas,2020-04-14T16:49:24Z,CT State Department of Education
OON1RGEDhOA,District Financial Considerations,2020-04-08T16:17:20Z,CT State Department of Education
dgR1XmqKUQU,Parent's Online Resources for Emergent Bilingual Students,2020-04-07T17:59:27Z,CT State Department of Education
hLMz8w7bYgo,Executive Orders and Education,2020-04-07T14:46:55Z,CT State Department of Education
pj0-2KlLNR8,Recursos en línea para padres con estudiantes bilingues emergentes,2020-04-06T18:13:40Z,CT State Department of Education
tN57satujFA,Social and Emotional Support for Children during COVID-19,2020-04-06T15:03:55Z,CT State Department of Education
tnFK_FBwj_I,High Quality Distance Learning Resources for English Learners,2020-04-03T19:56:25Z,CT State Department of Education
-CYrhUDeBa0,"Guidance on Special Education - Briefing on March 24, 2020, Guidance Document",2020-04-03T16:38:31Z,CT State Department of Education
cWEQEi3rORY,A message from Jaime Bairaktaris - Connecticut’s 2020 Anne Marie Murphy Paraeducator of the Year,2020-04-02T13:56:26Z,CT State Department of Education
AQ9Fk-0QA-c,National Census Day - A Message from CSDE's Dir. of Innovation and Partnerships Chris Soto,2020-04-01T21:04:41Z,CT State Department of Education
VKAF42DRD-s,Distance Learning for Preschool for Teachers,2020-04-01T20:14:47Z,CT State Department of Education
YqFATLgG27U,Distance Learning for Preschool For Families,2020-04-01T19:58:56Z,CT State Department of Education
S7OKPD4zhC4,Resources and Supports for Families during the COVID-19 Pandemic,2020-04-01T16:12:06Z,CT State Department of Education
lOde0Jr0DJo,CSDE Professional Support Series for Districts,2020-03-27T19:23:34Z,CT State Department of Education
Aup-fkULfWY,Foundations of Multi-Tiered Systems of Support – Comprehensive Behavior Support Planning,2020-03-16T19:05:15Z,CT State Department of Education
u5OS5k9R8E4,Foundations of Multi-Tiered Systems of Support – Practices Matched to Student Need,2020-03-16T19:05:06Z,CT State Department of Education
DGQVTFYiMRc,Foundations of Multi-Tiered Systems of Support - Student Family Community Involvement in Behavior Su,2020-03-16T19:04:58Z,CT State Department of Education
ofSKaioQuVA,Mini-Module Series Foundations of Multi-Tiered Systems of Support: Complete Set,2020-03-16T19:04:51Z,CT State Department of Education
1dwR4C6E9k8,Foundations of Multi-Tiered Systems of Support - Critical Features of Tier Two Interventions.,2020-03-16T19:04:25Z,CT State Department of Education
GZZiKoibKto,Foundations of Multi-Tiered Systems of Support: The Essential Components of a Hypothesis Statement,2020-03-16T19:04:18Z,CT State Department of Education
vX_TnHyzKxo,Linking the Connecticut Arts Standards to Practice - Arts webinar 4,2020-02-26T20:09:05Z,CT State Department of Education
_auxdDTqzTw,Initial Evaluation Timeline Webinar Questions and Answers,2020-02-24T18:21:41Z,CT State Department of Education
tA-ZX3ny0Ts,Resetting your CECS password and managing your user account,2020-02-10T19:55:47Z,CT State Department of Education
vOdgE8F5lEI,Certification Application Video,2020-01-07T16:13:45Z,CT State Department of Education
Msd00d9XNeY,NGSS: Evaluating Instructional Materials,2019-12-20T15:44:58Z,CT State Department of Education
ET1al5Ja4FE,Text Complexity,2019-10-02T13:52:50Z,CT State Department of Education
-ndc69GfC7U,CSDE 2019 Commissioner's Back to School meeting w/School Superintendents (Courtesy of CT-N),2019-08-26T21:49:05Z,CT State Department of Education
4qwW3EpDN4E,NGSS Environmental Education Resources,2019-08-22T17:14:40Z,CT State Department of Education
77CYA-EoCno,"eGrant Management System, Part 2",2019-07-23T13:26:46Z,CT State Department of Education
jxu-vQrT1zo,"eGrants Management Application, Part 1",2019-07-23T13:26:25Z,CT State Department of Education
xUDVCDjxmY8,Connecticut IEP Working Draft Overview,2019-07-10T18:41:54Z,CT State Department of Education
DTsncS8wBcI,Bidder's Conference for PreK Special Education Needs Assessment RFP,2019-06-11T16:52:59Z,CT State Department of Education
Q0KK9qKd9p4,Take the summer learning challenge!,2019-06-11T15:05:58Z,CT State Department of Education
_2pOJk443L0,Shifting Math Instruction: Rigor in the Classroom (Part 1 of 3),2019-06-07T12:49:18Z,CT State Department of Education
yAIOxD3D84k,Math Practice Standards: Classroom Evidence (Part 2 of 3),2019-06-07T12:48:54Z,CT State Department of Education
i-i-IchDba4,Instructional Coaching: Making the Most out of Math Coaches (Part 3 of 3),2019-06-07T12:48:26Z,CT State Department of Education
pYMoLuybzMo,Introduction to the Education Financial System (EFS),2019-05-24T18:18:43Z,CT State Department of Education
jil9fmAS_wk,Perkins V: An Introduction,2019-05-24T17:38:56Z,CT State Department of Education
nrp9bSf2L7E,Using the NGSS Science Interim Assessments in the Classroom  Overview 1,2019-05-22T13:12:15Z,CT State Department of Education
VxQCvYt8Pbs,Classroom-Level Assessments Resources Supportive of Implementation of the NGSS,2019-05-22T13:11:56Z,CT State Department of Education
QpfbUF84kLo,Teaching to the Connecticut Arts Standards: Webinar 2,2019-03-27T14:25:11Z,CT State Department of Education
VhuTWLDq3MU,Teaching to the Connecticut Arts Standards: Webinar 1,2019-03-04T16:53:49Z,CT State Department of Education
jHjT7GD6BRg,An Introduction to Connecticut's Next Generation Accountability System,2019-01-07T13:39:28Z,CT State Department of Education
4fXQ32Quw0Y,Computer Science Standards: From Adoption to Implementation,2018-09-21T19:08:00Z,CT State Department of Education
gttU2MVRE6E,Technology for Learning and Careers: ISTE Standards,2018-09-21T19:07:44Z,CT State Department of Education
Ccbwf32aY0A,TIDE Accommodations Entry 2016,2018-07-30T17:34:25Z,CT State Department of Education
eq8wW_lMZpM,Understanding the Smarter Balanced Growth Model Results,2018-07-30T17:34:25Z,CT State Department of Education
0l7ONvLYH2U,Webinar 4: Overview of the Smarter Balanced Mathematics Interim Assessments 2016,2018-07-30T17:34:24Z,CT State Department of Education
AdBMd27fXNk,Webinar 3 An Overview of the Smarter Balanced English Language ArtsLiteracy Interim Assessments 101,2018-07-30T17:34:24Z,CT State Department of Education
EBz-x04uCnA,Webinar 5:  Overview of AIR Ways 2016,2018-07-30T17:34:24Z,CT State Department of Education
LMALJvGkVsg,Webinar 2:  An Overview of the Smarter Balanced Interim Assessments 2016,2018-07-30T17:34:24Z,CT State Department of Education
hfZkH6N_Yyo,"2017-18 Smarter Balanced Interim Assessments, Webinar 3: Using the THSS 2018",2018-07-19T14:51:47Z,CT State Department of Education
-NV9wDieTAI,"2017-18 Smarter Balanced Interim Assessments, Webinar 2: Using Interim Assessment Data",2018-07-19T14:51:02Z,CT State Department of Education
f0NP1U_tsUk,2017-18 Smarter Balanced Interim Assessments Webinar 1,2018-07-19T14:49:51Z,CT State Department of Education
etiaBeXS_uA,Determining IAB Performance Categories 1,2018-07-19T14:39:37Z,CT State Department of Education
OrYnjqZNU5w,Determining Claim Level Performance Categories 1,2018-07-19T14:39:21Z,CT State Department of Education
qpdqp0zoKy4,NGSS Alt Field Test TEA Training,2018-07-19T14:35:09Z,CT State Department of Education
DumY8oKKtbA,Introducing the Writing Portfolio Guides for K 2 Grades,2018-07-19T14:23:44Z,CT State Department of Education
89YXfg32eLw,ESSA Early Childhood Overview,2018-07-18T18:30:20Z,CT State Department of Education
_O3SAZrEpBU,"The Shifts for the Connecticut Core Standards for Math, Part 3 of 3",2018-06-29T13:11:33Z,CT State Department of Education
IXQ5TDIONZY,"The Shifts for the Connecticut Core Standards for Math, Part 1 of 3",2018-06-04T18:22:17Z,CT State Department of Education
tEf0qxgJ5ME,"The Shifts for the Connecticut Core Standards for Math, Part 2 of 3",2018-06-04T17:28:47Z,CT State Department of Education
aUDQJEyyG4Y,TEAM for Principals: Guiding your beginning teacher on the journey to success,2018-04-02T18:59:30Z,CT State Department of Education
tExjWk-IVAM,Introduction to the Performance Index,2018-01-16T20:46:18Z,CT State Department of Education
DHTEW1FVrzs,Understanding Connecticut's Growth Metrics November 2017 narrated 20171130,2017-11-30T18:22:03Z,CT State Department of Education
x5kTnp5I1UY,Connecticut's Growth Model for the Smarter Balanced Summative Assessments,2017-11-21T20:52:30Z,CT State Department of Education
0rSKbNgaDg8,Desmos Calculators,2017-11-08T18:11:22Z,CT State Department of Education
pRzgkFy5hH8,Reducing Chronic Absence in Connecticut's Schools,2017-09-08T20:13:45Z,CT State Department of Education
VEWBgJ9HctU,Arts Webinar 5: Weaving Knowledge and Skills through the Music Standards (All Levels),2017-08-07T17:06:34Z,CT State Department of Education
wDW7GRG1aHM,Arts Webinar 4: Design Thinking for Digital Arts (Grades 7-12),2017-08-07T16:13:51Z,CT State Department of Education
pF4Ru19KDcU,Arts Webinar 3: Responding in the General and Ensemble Classroom (Elementary),2017-08-04T19:32:22Z,CT State Department of Education
g6ZKpbG9WA0,Arts Webinar 2: STEAM – Creative Art Maker Stations (Grades 6-12),2017-08-04T19:27:00Z,CT State Department of Education
mWKlxYqhMGQ,Arts Webinar 1: NCAS Standards in All 5 Arts - Understanding the Whats and Whys (All Grade Levels),2017-07-23T15:33:33Z,CT State Department of Education
5VstU7rtAKA,Arts Webinar 6: Old to New - Aligning a Digital Portrait Unit (Grades 9-12),2017-07-01T14:17:14Z,CT State Department of Education
ytVYHYkqoR0,CSDE Superintendents' ESSA Webinar #5:  Connecticut's State Plan,2017-03-01T18:41:58Z,CT State Department of Education
KPTjmVgNBuc,Superintendents' ESSA Webinar #4: Title II and III Under ESSA,2017-02-15T19:55:05Z,CT State Department of Education
eWhT-XdDvfw,Commissioner Wentzell Announces ESSA Public Comment Period,2017-02-03T20:11:31Z,CT State Department of Education
482IXjJyOrE,What's New on the Smarter Balanced Interim Assessments? - Webinar 1,2016-11-08T16:04:06Z,CT State Department of Education
0defAkt2lk4,Teaching the Middle East II 20161020 1933 1,2016-11-04T17:12:13Z,CT State Department of Education
55RgtXeYgMg,Teaching the 2016 Elections III,2016-11-03T18:51:10Z,CT State Department of Education
7JsMfF6NaBY,Red White and Blue Webinar,2016-11-03T18:51:10Z,CT State Department of Education
8EGt6d0nBlI,CSDE Superintendents' ESSA Webinar #1: ESSA Overview and 2016 Regulations,2016-11-03T18:51:10Z,CT State Department of Education
9VdiGhCVKz0,CSDE Superintendents' ESSA Webinar #3: Title I Under ESSA,2016-11-03T18:51:10Z,CT State Department of Education
DAzaOO-9jNw,Social Studies Literacy and the CT Core,2016-11-03T18:51:10Z,CT State Department of Education
Du_d_-99jVU,"Red, White, & Blue Webinar 20160907 1957 11",2016-11-03T18:51:10Z,CT State Department of Education
GhPPARO5Si0,The Inquiry Arc An Overview and Inquiry Dimension 1,2016-11-03T18:51:10Z,CT State Department of Education
H1Bz6rZYofU,Social Studies Grades K 5,2016-11-03T18:51:10Z,CT State Department of Education
ILWUc8hFh8Q,Teaching the Elections I 20160914 1945 1,2016-11-03T18:51:10Z,CT State Department of Education
md5qxjHNsSc,Introduction to Connecticut's Social Studies Frameworks,2016-11-03T18:51:10Z,CT State Department of Education
q7RWyRTuQ20,Inquiry Dimension 4  Effectively Presenting Findings and Taking Informed Action,2016-11-03T18:51:10Z,CT State Department of Education
rFIe74rBRG8,"CSDE Superintendents' ESSA Webinar #2: Accountability, Assessment, and Data Collection and Reporting",2016-11-03T18:51:10Z,CT State Department of Education
ygWCJwdGQuA,Inquiry Dimensions 2 & 3:  Thinking Like a Historian and Analyzing Sources,2016-11-03T18:51:10Z,CT State Department of Education
