youtube_id,title,publishedAt,channel_name
JLqnAYbUC-k,Virtual Learning Advisory Committee (VLAC) Meeting,2023-11-10T04:32:07Z,Virginia Department of Education
wWFWTIrDcZw,ABTEL November Meeting 11/09/23,2023-11-10T04:28:28Z,Virginia Department of Education
sBpBp7KQ_HY,Chronic Absenteeism Task Force 11/7/23,2023-11-08T11:47:21Z,Virginia Department of Education
2CnHbFVO2mk,College Partnership Laboratory Schools Standing Committee 11/06/23,2023-11-07T05:12:58Z,Virginia Department of Education
PYCnxYnBGzE,Virginia Interstate Compact Council 10/26/23,2023-10-27T04:26:15Z,Virginia Department of Education
dnjVCq8TMNQ,Chronic Absenteeism Task Force 10-24-23,2023-10-25T10:09:08Z,Virginia Department of Education
9M4lUs3zJaM,Virginia Board of Education Business Meeting 10/19/23,2023-10-20T03:01:49Z,Virginia Department of Education
GZ8VUbgJJwo,Virginia Board of Education 10/18/23,2023-10-18T21:59:44Z,Virginia Department of Education
O1KDIXdfjPA,Adult Education & Literacy Advisory Committee Meeting,2023-10-13T04:28:45Z,Virginia Department of Education
hkZwPVIlUy4,HB585 Meeting 5 Presentation,2023-10-05T13:22:20Z,Virginia Department of Education
Em8u7_3NOj8,Prioritization of 2023 Mathematics SOL Content for the 2023-2024 School Year - Elementary,2023-10-04T14:29:12Z,Virginia Department of Education
XHumnDA3z0k,Prioritization of 2023 Mathematics SOL Content for the 2023-2024 School Year - Secondary,2023-10-04T14:29:09Z,Virginia Department of Education
k8WA2elXTDU,College Partnership Laboratory Schools Standing Committee 10/3/23,2023-10-04T04:15:49Z,Virginia Department of Education
2oNmwfNX4H0,Integrated Lesson Plans - Virginia Alternate Assessment Program,2023-09-22T12:49:17Z,Virginia Department of Education
mVxlIEkiXrc,School Breakfast Supports Attendance in Virginia Schools,2023-09-15T17:49:45Z,Virginia Department of Education
TLRtmp0p8ok,Virginia Board of Education Business Meeting 9/14/23,2023-09-14T21:26:13Z,Virginia Department of Education
UnLAFvV4F0I,Virginia Board of Education Work Session 09/13/23,2023-09-14T01:43:10Z,Virginia Department of Education
WBYkLtGxd34,Virginia Board of Education - Special Meeting - 8/31/23,2023-08-31T22:07:36Z,Virginia Department of Education
0g0CH5Zik98,Virginia School Nutrition Director's Back to School Message for School Year 2023-2024,2023-08-22T19:35:25Z,Virginia Department of Education
bvraKNUNvN0,Assessment Updates: Fall 2023 Growth Assessments,2023-08-21T13:30:24Z,Virginia Department of Education
_11wkjVGFMc,Vertical Scaled Score Interpretation for Spring Standards of Learning (SOL) Assessments,2023-08-21T13:00:27Z,Virginia Department of Education
ayJJwsH8h0I,The Students with Intensive Support Needs Application: Instructions for Submission,2023-08-09T19:46:15Z,Virginia Department of Education
T1vkzaclcyg,VDOE Early Childhood State of the State Updates for Summer 2023,2023-08-01T16:29:45Z,Virginia Department of Education
En_hnFZcwPw,College Partnership Laboratory Schools Standing Committee,2023-08-01T04:38:08Z,Virginia Department of Education
JQCB9ZRLjbE,Virginia Board of Education - Business Meeting - 7-27-2023,2023-07-27T20:17:57Z,Virginia Department of Education
4JK-dB26WIc,Virginia Board of Education - Executive & Work Session - 7-26-23,2023-07-26T21:49:55Z,Virginia Department of Education
v1mrX6TWEJA,VDOE VAAP SDBQ Overview,2023-07-12T19:03:28Z,Virginia Department of Education
5oO01EObV0U,Legislative Update: School Counselor's Staff Time,2023-07-12T13:01:05Z,Virginia Department of Education
IoatncDyYu8,"College Partnership Laboratory Schools Standing Committee July 7, 2023",2023-07-08T02:48:02Z,Virginia Department of Education
9n97phPgnqo,ECCE Provider Legislative Lunch and Learn,2023-06-23T06:45:48Z,Virginia Department of Education
yVx44W1eabM,Early Childhood Admin's Personal Meeting Room,2023-06-22T06:52:44Z,Virginia Department of Education
2_rsB_NjaTw,Honoring Virginia’s 2023 Presidential Award Excellence in Mathematics and Science Teaching finalists,2023-06-21T13:18:17Z,Virginia Department of Education
KHKFCuUFKus,Virginia Board of Education 06/15/23,2023-06-15T19:09:18Z,Virginia Department of Education
F9JzuqQDXvE,Virginia Board of Education 06/14/23,2023-06-15T00:45:59Z,Virginia Department of Education
qENpeBlU1iY,HB585 Meeting 3 Presentations,2023-06-12T18:00:50Z,Virginia Department of Education
9mHUpagLKuU,College Partnership Laboratory Schools Standing Committee - 6-5-23,2023-06-06T05:50:38Z,Virginia Department of Education
kwN5sNr1y0A,2024 Virginia Teacher of the Year Jeffery W. Keller,2023-05-22T14:48:15Z,Virginia Department of Education
T8XayQh5NH8,Virginia Board of Education: Special Meeting 5-11-2023,2023-05-12T02:11:23Z,Virginia Department of Education
mZbyZmrUlgs,Virginia Board of Education: Emergency Meeting 5-11-2023,2023-05-11T14:16:00Z,Virginia Department of Education
Bs6uSedFz6M,State Superintendent Lisa Coons on Teacher Appreciation Week 2023,2023-05-08T16:10:02Z,Virginia Department of Education
o8-di13kF9Y,"Early Childhood Advisory Committee (ECAC) Meeting- April 27, 2023",2023-05-04T14:30:51Z,Virginia Department of Education
Jwr2cFSGScg,VLAC Meeting,2023-05-03T06:44:10Z,Virginia Department of Education
366mPsXujn8,VLAC Meeting,2023-05-02T17:05:49Z,Virginia Department of Education
sN8w9zvB45I,SAS Understanding support video 4/20/2023,2023-04-26T12:56:19Z,Virginia Department of Education
OhRnBn7mu1k,Virginia Board of Education 04/20/23 Part 2,2023-04-20T19:46:12Z,Virginia Department of Education
dt4yLkXh0TA,Virginia Board of Education 4/20/2023,2023-04-20T17:25:00Z,Virginia Department of Education
R7anPsA8HnA,Virginia Board of Education 04/19/2023,2023-04-20T00:36:50Z,Virginia Department of Education
CpEsczPdths,State Superintendent on Initial Priorities,2023-04-18T21:04:46Z,Virginia Department of Education
cVc4grjIHlk,State Superintendent Lisa Coons and 2024 Region 1 Teacher of the Year John Aughenbaugh,2023-04-18T18:08:13Z,Virginia Department of Education
yGi1A3siiSg,Superintendent of Public Instruction Lisa Coons on Serving the Commonwealth,2023-04-17T21:17:32Z,Virginia Department of Education
SVbR1xavbRo,College Partnership Laboratory School Standing Committee,2023-04-13T03:44:07Z,Virginia Department of Education
pAb84g26q5o,ABTEL Meeting Embassy,2023-04-03T14:03:06Z,Virginia Department of Education
PnFPdzRT5Rs,Vertical Scaled Score Interpretation for Winter Growth Assessments: Informational Video for Parents,2023-03-30T18:05:52Z,Virginia Department of Education
OXr4D2xH7qE,VDOE SOL SDBQ Overview,2023-03-30T16:32:17Z,Virginia Department of Education
-h2Ky_-EjyU,Virginia Literacy Act: Statewide Training for Reading Specialists,2023-03-29T17:08:58Z,Virginia Department of Education
I2d0HYV0kjw,Virginia Board of Education - Business Meeting - 03/23/23,2023-03-23T17:13:37Z,Virginia Department of Education
uI8vQmvgjXg,Virginia Board of Education - 03/22/23,2023-03-22T22:07:00Z,Virginia Department of Education
s2JphO_RDC0,"Early Childhood Advisory Committee (ECAC) Board Meeting- March 16, 2023",2023-03-16T21:10:33Z,Virginia Department of Education
42cnvsI2Ho0,College Partnership Laboratory Schools Committee 03/08/2023,2023-03-08T16:04:20Z,Virginia Department of Education
Drxb1xnADiE,ABTEL Meeting-Embassy Suites By Hilton Richmond Hotel,2023-03-06T16:20:44Z,Virginia Department of Education
qRwJukCEyPo,ABTEL Meeting- Embassy Suites By Hilton Richmond Hotel,2023-02-06T16:20:48Z,Virginia Department of Education
aVBxE2edPAY,Virginia Board of Education 02/02/2023 Business Meeting,2023-02-03T00:20:54Z,Virginia Department of Education
Z2ZrQ_TurX0,Virginia Board of Education - 02/01/2023,2023-02-02T01:42:05Z,Virginia Department of Education
UYahbzEwgrM,"College Partnership Laboratory Schools Committee Meeting February 1, 2023",2023-02-01T15:02:45Z,Virginia Department of Education
0yTyGPkT7zA,Virginia Board of Education - 02/01/2023,2023-02-01T15:01:07Z,Virginia Department of Education
CvCjMcm3hAY,2023-2024 IDEA Annual Plan Application Training (1/12/2023),2023-01-13T18:15:44Z,Virginia Department of Education
Q6EWx_PXYBs,ABTEL Meeting- Embassy Suites By Hilton Richmond Hotel,2023-01-09T16:10:31Z,Virginia Department of Education
CB-A7uiw94E,2022 Milken Educator Award Winner Pamela Stepko,2022-12-15T21:55:53Z,Virginia Department of Education
drGqjallu_U,ECAC 12_15_22,2022-12-15T20:31:20Z,Virginia Department of Education
jK9BTZ5WWwQ,School Division Maintenance of Effort (MOE) Training (12/7/2022),2022-12-08T14:23:25Z,Virginia Department of Education
lh_jguVCD2o,OSQ Principal Leadership Conference-Keynote,2022-12-07T14:21:53Z,Virginia Department of Education
vPIQhS2cYGw,Virginia Board of Education - Business Meeting 11/17/22,2022-11-18T01:34:23Z,Virginia Department of Education
8zG0S5k8Ok0,Virginia Board of Education - Business Meeting - 11/17/2022,2022-11-17T13:41:49Z,Virginia Department of Education
29YFhP04vpg,Virginia Board of Education - Business Meeting - 11/17/22,2022-11-17T13:37:52Z,Virginia Department of Education
eruQiqvPEAQ,Virginia Board of Education - Business meeting - 11/17/22,2022-11-17T13:35:07Z,Virginia Department of Education
uz6twWpcQsU,Virginia Board of Education Work Session - 11/16/22 *,2022-11-16T23:51:35Z,Virginia Department of Education
kcEE9ceXa64,Virginia Board of Education - Work Session - 11/16/2022,2022-11-16T18:39:48Z,Virginia Department of Education
H04UsGbvQB4,ABTEL Meeting-Embassy Suites By Hilton Richmond Hotel,2022-11-14T16:22:39Z,Virginia Department of Education
zQwnK9VizSA,Preparing Eligible Students for the Virginia Alternate Assessment Program,2022-10-28T11:58:33Z,Virginia Department of Education
srLqkcTOpok,Science Instruction for Students with Significant Cognitive Disabilities,2022-10-28T11:56:55Z,Virginia Department of Education
MbYGW8iMxdU,Where do we go from here? State Superintendent on 2022 NAEP Results,2022-10-25T17:03:43Z,Virginia Department of Education
XrkvZljvueQ,Lesson of Virginia's 2022 NAEP Results,2022-10-25T17:00:27Z,Virginia Department of Education
JjWHL35LIQE,"Announcement of 2022 Virginia NAEP Results October 24, 2022",2022-10-24T17:17:01Z,Virginia Department of Education
dQK7UJvpC-g,Virginia Department of Education - Business Meeting - 10/20/22,2022-10-20T22:14:03Z,Virginia Department of Education
b8yPRq2R_jQ,Virginia Board of Education - Work Session - 10/19/22,2022-10-19T22:24:59Z,Virginia Department of Education
l76BBFp2DW4,2023 Virginia Teacher of the Year,2022-10-03T21:23:22Z,Virginia Department of Education
MSc0qrph2zw,ABTEL Meeting- Embassy Suites By Hilton Richmond Hotel,2022-09-19T15:31:50Z,Virginia Department of Education
9HnjGmBhyaQ,Virginia Literacy Act Webinar - September 2022,2022-09-16T12:47:04Z,Virginia Department of Education
cczTSpUkw4Q,Virginia Board of Education - Business Meeting - 09/15/22,2022-09-15T21:52:27Z,Virginia Department of Education
XLY0vCLSzmg,Virginia Board of Education Work Session - 09/14/22,2022-09-14T22:20:20Z,Virginia Department of Education
6jC0HdvBV8M,Jillan Balow - Virginia Regional Teachers of the Year,2022-08-31T19:03:42Z,Virginia Department of Education
s5T3xPpu0Vg,Richmond Public Schools - Kiara Thompson - Region 1 Teacher of the Year,2022-08-31T17:53:49Z,Virginia Department of Education
-eDl2OzQh8Y,Virtual Learning Professional Learning Webinar Training,2022-08-30T14:04:23Z,Virginia Department of Education
93UKblpntwo,Virginia Board of Education - Business Meeting - 08/17/22 - PT2,2022-08-17T23:45:36Z,Virginia Department of Education
LYT9-P5_gHc,Virginia Board of Education - 08/17/22 - Business Meeting,2022-08-17T22:51:40Z,Virginia Department of Education
CVbiULvLqkc,Using the Student Detail by Question Extract File for Teachers,2022-08-17T16:16:58Z,Virginia Department of Education
NCDpFtu1FJk,Overview for Teachers: Grades 3-8 Reading and Mathematics Growth Assessments,2022-08-17T16:16:18Z,Virginia Department of Education
hUyPAkWm6FI,Virginia Board of Education - 08/17/22,2022-08-17T15:40:12Z,Virginia Department of Education
fbWk4kPUOjI,Virginia Board of Education - Work Session - 08/17/22,2022-08-17T12:38:30Z,Virginia Department of Education
4ORBp2cGNBU,Money Management: Storing Food Safely,2022-08-10T13:42:42Z,Virginia Department of Education
LnQEtl5Ux5g,Money Management: Blanching Veggies,2022-08-10T13:42:37Z,Virginia Department of Education
FL1KI2TmqbQ,Money Management: Bloopers,2022-08-10T13:42:34Z,Virginia Department of Education
zN5Yd7rx6Lc,Money Management: Kitchen Hacks,2022-08-10T13:42:31Z,Virginia Department of Education
eN0hiC0PGYU,Money Management: Cooking Beans,2022-08-10T13:42:28Z,Virginia Department of Education
Kg5wN9f1AEc,Money Management: Cooking Pasta to the Pan,2022-08-10T13:42:24Z,Virginia Department of Education
qEiJWnxz_94,Money Management: Knife Skills,2022-08-10T13:42:21Z,Virginia Department of Education
6tp-XZEDr30,Money Management: Roasting Veggies,2022-08-10T13:42:18Z,Virginia Department of Education
xdchdwOrhEk,Money Management: Sectionizer,2022-08-10T13:42:15Z,Virginia Department of Education
254qpY-OZqY,Money Management: Standard Time Comparison,2022-08-10T13:42:11Z,Virginia Department of Education
4z5E6_8G-7s,Money Management: Steaming Rice,2022-08-10T13:42:08Z,Virginia Department of Education
hMYkscWX_FM,Money Management: Tilt Skillet,2022-08-10T13:42:05Z,Virginia Department of Education
pPXXZGmbs0Y,Using Standards of Learning Assessment Data to Inform Instruction in Reading,2022-08-03T14:53:29Z,Virginia Department of Education
h60cIMdslas,Using Standards of Learning Assessment Data to Inform Instruction in Mathematics,2022-08-03T14:53:15Z,Virginia Department of Education
i7W9vz5-epI,2022 SISNA Training,2022-07-26T15:29:32Z,Virginia Department of Education
EW77FigoQEE,VDOE Early Childhood State of the State Updates for Summer 2022,2022-07-18T15:05:21Z,Virginia Department of Education
Il3Q5EW6cW4,Health Science: Shanita King Stokes,2022-07-12T15:12:02Z,Virginia Department of Education
SubvedQtAKY,State Superintendent: 2022 Federal Rating Reflects Great Work of Virginia Special Educators,2022-07-11T16:54:27Z,Virginia Department of Education
Q_56PseYG0w,2022 Federal Special Education Rating Reflects Multiple Measures of Student Progress,2022-07-11T16:51:09Z,Virginia Department of Education
WdDQzVUjInc,State Superintendent Jillian Balow on Virginia's 2022 Federal Special Education Rating,2022-07-11T16:47:24Z,Virginia Department of Education
XJzVroKG4K4,Early Childhood - Public Engagement Session 06\29\22,2022-06-29T18:32:35Z,Virginia Department of Education
0Xemy20DDPs,"Early Childhood Advisory Committee (ECAC) Board Meeting June 23, 2022",2022-06-23T19:35:31Z,Virginia Department of Education
TgP37hpGc5w,Architecture & Construction: James Thomas,2022-06-17T19:27:17Z,Virginia Department of Education
zEah2uj2eFE,Business Management & Administration: Brandon Mills,2022-06-17T19:27:13Z,Virginia Department of Education
ByqnEgl5MOw,Government & Public Administration: Darius Kates,2022-06-17T19:27:10Z,Virginia Department of Education
KOHk0XG_d3w,Human Services: Jessica Hill,2022-06-17T19:27:07Z,Virginia Department of Education
LBwRZWIf09k,"Law, Public Safety, Corrections & Security: Maria Pineda",2022-06-17T19:27:03Z,Virginia Department of Education
rL7dinO9S4I,Marketing: Jessica Picardi,2022-06-17T19:26:59Z,Virginia Department of Education
8x2zyqcUghU,Military: Eric Harris,2022-06-17T19:26:56Z,Virginia Department of Education
wvsnbed7elg,"Science, Technology, Engineering & Mathematics: Olivia Heisner",2022-06-17T19:26:53Z,Virginia Department of Education
U8ZSzBXFud4,Education & Training: Briana Smith,2022-06-17T19:26:49Z,Virginia Department of Education
TaVHEx_u1AI,Energy: Sarah Marshall,2022-06-17T19:26:47Z,Virginia Department of Education
jYLpCw84AVU,Hospitality & Tourism: Savannah Haley,2022-06-17T19:26:44Z,Virginia Department of Education
Yy2-rJzlHE0,"Transportation, Distribution & Logistics: Carlton Wethington",2022-06-17T19:26:41Z,Virginia Department of Education
PAmH7dfxOlo,"Arts, A/V Technology & Communications: Steve Wilks",2022-06-17T19:26:36Z,Virginia Department of Education
8WP9O03SeLU,"Agriculture, Food & Natural Resources: Keonte Edmonds",2022-06-17T19:26:34Z,Virginia Department of Education
eTtSAAUp8-A,Information Technology: Shad Chase,2022-06-17T19:26:27Z,Virginia Department of Education
AXOdISNb8ME,Finance: Aaron Bostic,2022-06-17T19:26:25Z,Virginia Department of Education
jTcpKzGpSrM,Virginia Department of Education - Business Meeting Part 2 - 06/15/22,2022-06-15T19:47:15Z,Virginia Department of Education
IciXEaicTkY,Virginia Department of Education - Business Meeting - 06/15/22,2022-06-15T18:56:43Z,Virginia Department of Education
fcT_yDW8lM4,What do Students Need to Thrive?,2022-06-14T18:00:05Z,Virginia Department of Education
mJJqo1utdOs,"Early Childhood Advisory Committee (ECAC) Board Meeting May 19, 2022",2022-05-19T19:34:59Z,Virginia Department of Education
IIhqiT4rNY0,Master Schedule Collation (MSC) for Regional Centers – May 2022,2022-05-11T17:09:29Z,Virginia Department of Education
pSJ0tNJ699c,"Taylor Goodson Milken Award, May 4, 2022",2022-05-10T20:37:54Z,Virginia Department of Education
TlwgvtNLqXY,"Kimberly Collins Milken Award, May 4, 2022",2022-05-10T20:37:44Z,Virginia Department of Education
0SQKKAIv-LE,Virtual Learning MOP Webinar,2022-05-09T15:53:20Z,Virginia Department of Education
2VtLBlu2SGU,Secretary of Education Aimee Guidera on Teacher Appreciation Week,2022-05-02T17:53:59Z,Virginia Department of Education
zWOTl4jVJEY,Governor Glenn Youngkin Proclaims Teacher Appreciation Week,2022-05-02T17:49:54Z,Virginia Department of Education
ZIWCxX9x2K4,Virtual Learning Advisory Committee (VLAC) Meeting,2022-04-27T18:49:58Z,Virginia Department of Education
rt7G6H1EqhY,Virginia Board of Education - Business Meeting - 04/21/22,2022-04-21T15:42:03Z,Virginia Department of Education
RfScME8c_4k,Board of Education - Work Session - 04/20/22,2022-04-20T20:41:21Z,Virginia Department of Education
EGyzJjHe8Ak,Board of Education - Work Session - 04/20/22,2022-04-20T17:14:08Z,Virginia Department of Education
w5ey4cJ4rw8,ABTEL April 2022,2022-04-18T14:46:21Z,Virginia Department of Education
OGYEr7dz0Qo,CTE Advisory Committee Meeting Link,2022-04-14T17:07:45Z,Virginia Department of Education
k6tpSPT7k8M,Superintendent of Public Instruction Jillian Balow discusses recent trends in reading and literacy.,2022-04-05T14:48:53Z,Virginia Department of Education
6-HOX5yNHZs,Jillian Balow on the Virginia Literacy Act,2022-04-05T14:38:46Z,Virginia Department of Education
zNZD8HTSDBs,"Early Childhood Advisory Committee (ECAC) Board Meeting March 24, 2022",2022-03-24T19:42:24Z,Virginia Department of Education
JiDmE7TMYNc,Virtual Learning Webinar 3,2022-03-22T15:00:40Z,Virginia Department of Education
eXX1ZTlC7Rw,"ABTEL MARCH 21, 2022",2022-03-21T15:19:22Z,Virginia Department of Education
_NZ6ElwUFfU,Board of Education Business Meeting 03/17/2022,2022-03-17T17:41:15Z,Virginia Department of Education
o6mp7kqcops,Virginia Board of Education Business Meeting 03/17/22,2022-03-17T12:58:32Z,Virginia Department of Education
IWWkBYMYDSg,Virginia Board of Education - Work Session 03/16/22,2022-03-16T21:23:46Z,Virginia Department of Education
5Xmm2wPBGaw,Standards/Curriculum Frameworks Board and Public Hearings for Driver's Education and PE,2022-02-17T01:56:50Z,Virginia Department of Education
cZEPemcJeKw,Standards/Curriculum Frameworks Board and Public Hearings for Driver's Education and PE,2022-02-08T23:22:15Z,Virginia Department of Education
TwfvfWV7zJU,ABTEL  January Meeting Embassy Suite,2022-01-31T16:28:52Z,Virginia Department of Education
G_cUYsYVGxk,Virginia Board of Education - Business Meeting,2022-01-27T17:07:47Z,Virginia Department of Education
j0B70VSHiG0,Virginia Board of Education - Business Meeting,2022-01-27T14:04:18Z,Virginia Department of Education
1iQWG_hmbFk,Virginia Board of Education - Business Meeting,2022-01-27T14:00:33Z,Virginia Department of Education
nosmz8LcR2o,Virginia Board of Education - Business Meeting - 1/27/22,2022-01-27T13:58:31Z,Virginia Department of Education
xDrX-laG31A,Virginia Board of Education - Business Meeting - 1/27/22,2022-01-27T13:54:03Z,Virginia Department of Education
-pjrF5L2idQ,Virginia Department of Education - Business Meeting - 01/27/22,2022-01-27T13:50:12Z,Virginia Department of Education
2RhcG7L2qVs,Virginia Board of Education - Business Meeting - 1/27/22,2022-01-27T13:47:49Z,Virginia Department of Education
yyTdlVgmZjw,Virginia Board of Education - Work Session - 01/26/22,2022-01-26T21:25:49Z,Virginia Department of Education
XHUdy1piU6s,Module 1 – Introduction,2022-01-26T18:22:58Z,Virginia Department of Education
IjwsWTfCGNY,2022 2023 Annual Plan Application Training,2022-01-25T21:27:05Z,Virginia Department of Education
P3s9xLl9alU,MOE Annual Training 2020-2021,2022-01-21T13:49:24Z,Virginia Department of Education
dIpeymlXuIE,Public Hearing 2 - Proposed Data Science Standards,2022-01-21T01:09:01Z,Virginia Department of Education
EvbBdcIjuwc,CTE Advisory Committee Meeting,2022-01-20T18:07:03Z,Virginia Department of Education
YYqKE4wL3n0,Conducting the Comprehensive Needs Assessment (CNA),2022-01-18T14:28:09Z,Virginia Department of Education
YC2sboeqyyM,Public Hearing 1 - Proposed Data Science Standards of Learning,2022-01-11T22:52:28Z,Virginia Department of Education
P45Jx6CfhXE,OCCHS Review of 2021/Look Ahead to 2022,2021-12-17T18:55:48Z,Virginia Department of Education
1fApAJTURwQ,VACAG Meeting 12/10/21,2021-12-13T19:15:52Z,Virginia Department of Education
fG62EmJWAtU,VAAP Module 3 Training - Preparing for New VAAP Test Administration,2021-12-13T13:16:46Z,Virginia Department of Education
AtiMcm03UKc,* Module IV Implementation and Monitoring of the Comprehensive School Improvement Plan,2021-12-08T14:36:41Z,Virginia Department of Education
JX59Swz1lu0,Applied Studies Diploma Part 2: The Curriculum Map,2021-11-19T14:05:59Z,Virginia Department of Education
CdRRldE15gM,Applied Studies Diploma Part 3: Instruction,2021-11-19T14:05:54Z,Virginia Department of Education
v0jFEykeN6Q,Applied Studies Diploma Overview,2021-11-19T14:05:21Z,Virginia Department of Education
FX35Tqovako,Applied Studies Diploma Part 4: Planning & Reporting,2021-11-19T14:04:29Z,Virginia Department of Education
RAzNLxz7d9M,Virginia Department of Education Business Meeting - 11/18/21,2021-11-18T16:18:23Z,Virginia Department of Education
tSVbPMoXiH8,Principal Leadership Conference-Leading in the Midst of Change,2021-11-18T14:01:19Z,Virginia Department of Education
MYaUpCmb1Oc,Information for Teachers: Grades 3-8 Reading and Mathematics Growth Assessments,2021-11-18T12:23:47Z,Virginia Department of Education
nhXt0Qthp1I,Virginia Board of Education Work Session - 11/17/21,2021-11-17T20:13:53Z,Virginia Department of Education
kdmMAgiqj_I,Virginia Board of Education Work Session - 11/17/21,2021-11-17T17:51:01Z,Virginia Department of Education
90n_tG2GHvY,Structuring Effective Intervention in the Secondary Mathematics Classroom *,2021-11-16T13:45:52Z,Virginia Department of Education
QBX6GkWBfds,"ABTEL Meeting - November 15, 2021",2021-11-15T15:52:10Z,Virginia Department of Education
xbdcBf7WPpY,Virginia Interstate Compact Council Meeting,2021-11-12T16:22:09Z,Virginia Department of Education
2x85amm3pjU,Virginia Update on Youth Mental Health (2021),2021-11-11T00:52:39Z,Virginia Department of Education
7tjDc97PKds,Virginia's Early Childhood Advisory Committee (ECAC) Board Meeting,2021-11-10T21:14:22Z,Virginia Department of Education
44206JaP1yE,Virginia School Bus Charging Assessment Workshop,2021-11-04T17:51:56Z,Virginia Department of Education
K068ub6pqCw,Proportionate Set Aside 2021 22 Submission Training,2021-11-04T13:47:29Z,Virginia Department of Education
nCCBt8Sbt9g,Proportionate Set Aside 2020 21 Data Submission Training,2021-11-04T13:38:47Z,Virginia Department of Education
V_hcmabuNWc,Adult Education and Literacy Advisory Committee,2021-10-28T16:18:17Z,Virginia Department of Education
_G9BnisZ3jc,ABTEL Advisory Board on Teacher Education and Licensure,2021-10-27T20:23:57Z,Virginia Department of Education
SkXheZJJS4c,ABTEL Advisory Board on Teacher Education and Licensure,2021-10-27T18:13:39Z,Virginia Department of Education
NdLyHTa5jN0,Structuring Effective Intervention in the Elementary Mathematics Classroom,2021-10-26T16:12:41Z,Virginia Department of Education
oU-oHldEw1A,Using Small Group Instruction to Address Unfinished Learning in the Elementary Mathematics Classroom,2021-10-25T13:22:59Z,Virginia Department of Education
q61lcvMDSNE,Using Small Group Instruction to Address Unfinished Learning in the Secondary Mathematics Classroom,2021-10-25T13:18:00Z,Virginia Department of Education
97zzj5O0CdU,2022 Virginia Teacher of the Year: Daphne Fulson,2021-10-21T20:54:07Z,Virginia Department of Education
i0wBFGyfpWI,The Virginia Board of Education: Business Meeting - 10/21/21,2021-10-21T15:11:13Z,Virginia Department of Education
ub8y7db0PjE,The Virginia Board of Education: Business Meeting - 10/21/21,2021-10-21T12:49:30Z,Virginia Department of Education
eSl1gssmSnk,The Virginia Board of Education: Standards of Quality 10/20/21,2021-10-20T21:22:44Z,Virginia Department of Education
-3RuSii4Tw8,VACEG 10 - 15 - 21,2021-10-15T16:18:09Z,Virginia Department of Education
2039Ufc3fR0,IDEA MOE: Help! I might not meet MOE! October 13 2021,2021-10-15T14:34:54Z,Virginia Department of Education
70gp9hL26QE,VAAP Module 2 Training - Student Participation in the New VAAP,2021-10-15T11:43:47Z,Virginia Department of Education
G5eII6NsbVg,2022 Virginia Teacher of the Year,2021-10-14T22:19:04Z,Virginia Department of Education
xo-ICnPw-jg,Bridging for Math Strength Part 2:  Grades K-2,2021-10-04T16:12:35Z,Virginia Department of Education
xYttOXkAHDE,Bridging for Math Strength Part 2:  Grades 3-8,2021-10-04T16:07:39Z,Virginia Department of Education
1u07GUJztPI,Virtual Learning Advisory Committee (VLAC) Meeting,2021-09-29T18:37:42Z,Virginia Department of Education
y9k_8XyzW_g,Suicide Prevention Month: 2021 Week Five,2021-09-27T04:00:13Z,Virginia Department of Education
hLoj11SnV9o,VAAP Module 1 Training - VESOL Instructional and Curricular Resources,2021-09-23T15:49:36Z,Virginia Department of Education
GK4Pl0tXctw,Virginia Board of Education - 09/23/21,2021-09-23T15:42:54Z,Virginia Department of Education
YPUIsSuRm5g,Virginia Department of Education - 09/22/21 - SOQ *,2021-09-22T20:45:59Z,Virginia Department of Education
k3WSP9Oc2WE,Virginia Board of Education - 09/22/21 - SOQ,2021-09-22T19:06:57Z,Virginia Department of Education
jH9QFN76zyk,Comprehensive School Improvement Plan Training,2021-09-20T15:34:30Z,Virginia Department of Education
CX-a-1FwLWE,2021 - 2022 Monitoring and Support Training for Level Three and Federally Identified Schools,2021-09-17T17:44:05Z,Virginia Department of Education
eyBI6qkXhgc,"New School Coordinator Orientation, 1.0",2021-09-17T13:34:04Z,Virginia Department of Education
D5T800HwbRE,"New School Nurse Orientation, 1.0",2021-09-17T13:33:37Z,Virginia Department of Education
6Ie1JNTOwzs,Child Care Health & Safety - Statewide Q & A Webinar,2021-09-15T19:45:18Z,Virginia Department of Education
MiIWzWb9Hi8,Virginia's Early Childhood Advisory Committee (ECAC) Board Meeting,2021-09-15T19:41:14Z,Virginia Department of Education
Y25nz0Fkq_A,CTE High School Innovation Grant Reporting Requirements Video,2021-09-09T18:15:38Z,Virginia Department of Education
r1BuRMVW3Mc,Family Literacy Night  Early Literacy Starts At Home,2021-09-01T22:00:00Z,Virginia Department of Education
GbFKMol0uGM,Bridging for Math Strength Webinar - Grades 3-8,2021-09-01T17:33:38Z,Virginia Department of Education
6w3m8W9VYXM,Bridging for Math Strength Webinar - Grades K-2,2021-09-01T17:33:34Z,Virginia Department of Education
shEIUI83DUQ,Family Literacy Night- Understanding Phonological and Phonemic Awareness,2021-09-01T01:09:03Z,Virginia Department of Education
wdaCWknohK0,Family Literacy Night- Equity & Community Engagement,2021-09-01T00:53:59Z,Virginia Department of Education
AKyRLhcQCYA,Family Literacy Night: An Introduction to Rubrics and Scoring,2021-09-01T00:44:22Z,Virginia Department of Education
BO8V1hdsAzw,Family Literacy Night- Family Engagement- Supports for the Home,2021-09-01T00:06:04Z,Virginia Department of Education
yIt_BXt4EgM,FLN: Choosing Reading Materials for Children in Your Lives,2021-09-01T00:05:58Z,Virginia Department of Education
lBQJw8DTmbQ,Family Literacy Night Virginia Association for Teachers of English,2021-09-01T00:04:48Z,Virginia Department of Education
TG6SvMxzDOc,Family Literacy Night Family Field Trips: Connecting Literacy to the Commonwealth,2021-08-31T23:10:29Z,Virginia Department of Education
8UzTWJEAqpI,Family Literacy Night: Assessment Supports,2021-08-31T23:08:30Z,Virginia Department of Education
6K0PDANTflg,Addressing Unfinished Learning in Secondary Mathematics,2021-08-27T20:04:45Z,Virginia Department of Education
_MFlkldFjGM,Addressing Unfinished Learning in Elementary Mathematics,2021-08-27T20:03:22Z,Virginia Department of Education
Zfu9OtHzEwU,Strengthening Mathematical Literacy at Home,2021-08-27T20:02:17Z,Virginia Department of Education
1t3No2FdeHU,TestNav 8 Functionality Overview,2021-08-18T18:48:17Z,Virginia Department of Education
vgqaijxIk3s,Career One Stop Webinar,2021-08-16T18:29:41Z,Virginia Department of Education
Yfye_bE6wg4,"IDEA Part B and ARP Funds Management Training Session - August 12, 2021",2021-08-12T19:55:09Z,Virginia Department of Education
iGFi-Xm-HE4,TECH TOOLS for SCHOOL COUNSELORS: Super Google User,2021-08-03T13:42:04Z,Virginia Department of Education
vDrirarTRLY,Affirming & Inclusive School Culture,2021-07-28T21:27:42Z,Virginia Department of Education
q7jOfPX5wi4,"Virginia Board of Education - Business Meeting - July 22, 2021",2021-07-22T16:23:17Z,Virginia Department of Education
G1Wbk7TDZGg,"Virginia Board of Education - SOQ - July 21, 2021",2021-07-21T20:07:32Z,Virginia Department of Education
wtJ44RMB7IA,"BOE - July 21, 2021",2021-07-21T15:20:32Z,Virginia Department of Education
BjSC1zh6gUU,"SSEAC MEETING July 16, 2021",2021-07-16T15:00:28Z,Virginia Department of Education
qDcF_xeHR2Y,SSEAC MEETING,2021-07-15T16:04:36Z,Virginia Department of Education
uF1wnNyIgZ4,Virginia's Early Childhood Advisory Committee (ECAC) Board Meeting,2021-07-14T19:31:13Z,Virginia Department of Education
KVWei6SnvTI,"Suicide Prevention Training for School Staff, PART ONE",2021-06-30T05:41:27Z,Virginia Department of Education
jOi_8JjGWf0,"Suicide Prevention Training for School Staff, PART TWO",2021-06-30T05:30:11Z,Virginia Department of Education
78_31ERBj7U,New VAAP Introductory Webinar,2021-06-24T19:34:42Z,Virginia Department of Education
wciUX5Drjz4,CTE High School Innovation Grant Video,2021-06-23T19:33:38Z,Virginia Department of Education
_m2HA_4ftqQ,Virginia Board of Education Business Meeting - 6-17-2021,2021-06-17T19:24:57Z,Virginia Department of Education
JP6Z4I_AzYA,Virginia Board of Education Business Meeting - 6-17-2021,2021-06-17T12:39:39Z,Virginia Department of Education
GdmjTI-I6IE,Virginia Board of Education - Committee on the Standards of Quality,2021-06-16T20:19:58Z,Virginia Department of Education
LzY3-loyIP4,New VAAP Introductory Webinar,2021-06-15T13:10:56Z,Virginia Department of Education
5XWGp5EJDyw,Virginia Culturally Relevant and Inclusive Education Practices Advisory Committee Meeting,2021-06-10T18:37:22Z,Virginia Department of Education
oCDTpG1nDKU,"CTE Advisory Committee Meeting June10, 2021",2021-06-10T16:35:12Z,Virginia Department of Education
pYpCj4U7H4s,Creating Excellence Awards,2021-06-09T14:22:27Z,Virginia Department of Education
gQTk5L5ZaLs,LASER Demo/Q&A Sessions.,2021-06-02T19:27:16Z,Virginia Department of Education
dvhjcZXg0LE,VMPI Community Meeting 4 - May 25 (You-Tube Live Streaming),2021-05-25T23:35:04Z,Virginia Department of Education
ye80s0SJHqQ,Social-Emotional Learning and Supports for English Learners,2021-05-20T14:38:21Z,Virginia Department of Education
C6_cdK_OnKE,Virginia's Early Childhood Advisory Committee (ECAC) Board Meeting,2021-05-19T20:00:31Z,Virginia Department of Education
81X_iAnI8e0,Virginia Military Signing Day Virtual Celebration,2021-05-12T23:26:19Z,Virginia Department of Education
wXw5vwrOT3w,Reporting Indicator 13,2021-05-06T15:31:15Z,Virginia Department of Education
1YxDjg2G0Qw,VMPI Community Meeting 3 - April 27 (You-Tube Live Streaming),2021-04-27T23:22:51Z,Virginia Department of Education
pmmstIRkLZI,2021-2022 NAPE Application Webinar,2021-04-26T17:20:32Z,Virginia Department of Education
XKoKEv7P0Ws,ABTEL Meeting,2021-04-26T15:12:10Z,Virginia Department of Education
udP8LrwYZJk,VACEG BOE Committee,2021-04-23T15:58:52Z,Virginia Department of Education
lexBvJdBJHo,"April 22, 2021 - Board of Education Business Meeting",2021-04-22T18:05:36Z,Virginia Department of Education
sN4pbYcejAc,"April 21, 2021 - Board of Education Retreat",2021-04-21T20:08:08Z,Virginia Department of Education
rKIx9lmLEV0,"April 21, 2021 - Board of Education Work Session",2021-04-21T15:19:44Z,Virginia Department of Education
LVpvdfY9L9w,"April 20, 2021 Special Committee to Review the Standards of Accreditation",2021-04-20T20:14:55Z,Virginia Department of Education
PSy8S52erbA,Virginia Board of Education's Personal Meeting Room,2021-04-20T17:44:24Z,Virginia Department of Education
8RRaE0z48XA,Virginia Board of Education's Personal Meeting Room,2021-04-20T17:34:34Z,Virginia Department of Education
kSagTVYqujo,Virginia Interstate Compact Council Meeting,2021-04-20T15:26:56Z,Virginia Department of Education
nlnoa2JTDKw,Virginia Interstate Compact Council Meeting,2021-04-20T15:16:38Z,Virginia Department of Education
yUysKvUvgQE,Virginia CTE Advisory Committee Meeting,2021-04-15T15:16:27Z,Virginia Department of Education
ds9w2xO6XAY,Postsecondary Transition,2021-04-14T17:51:34Z,Virginia Department of Education
hEPUWhIC2tI,VMPI Community Meeting 2 - April 13 (You-Tube Live Streaming),2021-04-13T23:36:01Z,Virginia Department of Education
2f4U3tM-zR4,ABTEL Meeting,2021-04-12T13:44:41Z,Virginia Department of Education
8K-nNwIr_js,"Early Childhood Advisory Committee (ECAC) Board Meeting - March 24, 2021",2021-03-24T21:00:19Z,Virginia Department of Education
WK0JTkqqAws,VMPI Community Meeting 1 - March (You-Tube Live Streaming),2021-03-23T23:33:39Z,Virginia Department of Education
YkX-0LGBp8I,"CTE End-of-Year: Financial Reports, Data Collection, and Credential Collection",2021-03-19T13:35:48Z,Virginia Department of Education
eMU5k9aPH2M,"March 18, 2021 Board Business Meeting",2021-03-18T16:49:28Z,Virginia Department of Education
lfw6lprxWLM,"March 17, 2021 Special Committee to Review the Standards of Accreditation",2021-03-17T20:42:04Z,Virginia Department of Education
8cq2YTw6F-8,Virginia Board of Education's Personal Meeting Room,2021-03-17T16:37:00Z,Virginia Department of Education
1ZuGlCpYifQ,Virginia Board of Education's Personal Meeting Room,2021-03-17T15:06:43Z,Virginia Department of Education
u0LjJyLRDzU,Virginia Culturally Relevant and Inclusive Education Practices Advisory Committee Meeting,2021-03-16T18:26:14Z,Virginia Department of Education
Mk5vFnp_12I,My Meeting,2021-03-15T14:56:23Z,Virginia Department of Education
5Zxtya-vEmk,Virtual Learning Advisory Committee (VLAC),2021-03-15T14:39:35Z,Virginia Department of Education
xvUL4n9U74Q,SSEAC Meeting,2021-03-12T16:47:24Z,Virginia Department of Education
VNdHXsx-Wxw,SSEAC Meeting,2021-03-11T17:55:50Z,Virginia Department of Education
8VRWRpxmgYw,Adult Education and Literacy Advisory Committee,2021-03-11T17:22:05Z,Virginia Department of Education
N14Xz1d8DlE,Schema Based Instruction VDOE Webinar,2021-03-10T19:57:04Z,Virginia Department of Education
kA09lemIsK0,SSEAC Meeting,2021-03-10T17:51:33Z,Virginia Department of Education
gDMwK9b6Yag,Increasing School Readiness by Increasing Access to Preschool in Your Community Part 2,2021-03-03T01:03:54Z,Virginia Department of Education
Mdg3ibX9DEA,Virginia's Early Childhood Advisory Committee (ECAC) Kick-Off Meeting,2021-02-25T21:42:35Z,Virginia Department of Education
KiqeDA6CVoI,Virginia's Early Childhood Advisory Committee (ECAC) Kick-Off Meeting,2021-02-25T19:24:12Z,Virginia Department of Education
2rJ0Um97fHc,Virginia CTE Advisory Committee Meeting,2021-02-25T16:25:41Z,Virginia Department of Education
ehSIahxYBZk,Virginia Culturally Relevant and Inclusive Education Practices Advisory Committee Meeting,2021-02-19T19:45:37Z,Virginia Department of Education
ZznsEvwlLpk,VACEG BOE Committee,2021-02-05T17:07:49Z,Virginia Department of Education
otkZeaJYnjU,Civics Survey Webinar,2021-02-02T21:02:47Z,Virginia Department of Education
Sf8KwtLx4LA,Virginia School Survey Webinar,2021-02-02T21:01:04Z,Virginia Department of Education
pcUYWGjJhuE,"ABTEL Meeting  -- February 1, 2021",2021-02-01T17:23:52Z,Virginia Department of Education
P6kmxaBMey0,"January 28, 2021  - Board Business Meeting",2021-01-28T20:30:52Z,Virginia Department of Education
uckpkAmkm48,"January 27, 2021 - Special Committee to Review the Standards of Accreditation",2021-01-27T20:41:41Z,Virginia Department of Education
-4ciTT3zpsw,"January 27, 2021 - Executive Session",2021-01-27T15:56:48Z,Virginia Department of Education
MxyAUwhAesI,"January 27, 2021 - Executive Session",2021-01-27T15:07:19Z,Virginia Department of Education
VreSUMP_Crs,ABTEL WORKGROUP MEETING ON RENEWAL,2021-01-26T21:21:52Z,Virginia Department of Education
jHI6LDKpjbA,Governor's Scorecard on Nutrition and Physical Activity,2021-01-22T17:57:49Z,Virginia Department of Education
Yej8LpbNCPU,Just In Time Professional Development - Geometry,2021-01-12T15:59:38Z,Virginia Department of Education
808ghEjbHPs,Just in Time Professional Development - Algebra II,2021-01-12T15:59:32Z,Virginia Department of Education
RkDMOdZhaK4,Virginia Culturally Relevant and Inclusive Education Practices Advisory Committee Meeting,2021-01-06T21:18:41Z,Virginia Department of Education
UjOSHO1Wi4g,World Language SOL Public Hearing,2021-01-06T00:21:52Z,Virginia Department of Education
dGLtcO0zaeg,Implementing Rich Mathematical Tasks Remotely in the Grades 9-12 Classroom,2020-12-18T15:00:51Z,Virginia Department of Education
y2mh1RMQGeI,Implementing Rich Mathematical Tasks Remotely in the Grades 6-8 Classroom,2020-12-18T15:00:32Z,Virginia Department of Education
sCrt-ZmDZYA,Implementing Rich Mathematical Tasks Remotely in the Grades 3 5 Classroom *,2020-12-18T15:00:12Z,Virginia Department of Education
MkqCdgLDbB4,Implementing Rich Mathematical Tasks Remotely in the K-2 Classroom,2020-12-18T14:59:25Z,Virginia Department of Education
p3yAnz9m1ZQ,Virginia Council on the interstate Compact for the Educational Opportunity of Military Children,2020-12-17T23:58:29Z,Virginia Department of Education
Db4eSGxBul4,Evidence Based Specially Designed Instruction in Mathematics,2020-12-17T16:03:51Z,Virginia Department of Education
vuqgQmYn-_E,VACEG Dec 4 Meeting,2020-12-04T23:22:23Z,Virginia Department of Education
YKSVOBbBvzI,SSEAC MEETING,2020-12-04T23:17:27Z,Virginia Department of Education
rGXh2oRDWEU,SSEAC MEETING,2020-12-03T23:53:14Z,Virginia Department of Education
Wlt9yUya3cg,Strategies for Supporting Attendance and Student Engagement During COVID-19,2020-12-03T22:31:11Z,Virginia Department of Education
LBVuH7vYesU,Mary Peake Award Recognition,2020-12-03T19:42:42Z,Virginia Department of Education
hJR7bznBO_4,December Difference Makers,2020-12-02T23:10:15Z,Virginia Department of Education
ivMPms-0LCw,Evaluating the collection of evidence to verify credit in writing,2020-12-02T20:28:17Z,Virginia Department of Education
MT0xJu5VHCk,Safety Best Practices and Infectious Disease Preparedness,2020-11-20T20:26:20Z,Virginia Department of Education
8fYGbaXRHTY,"November 19, 2020 - Board Business Meeting",2020-11-19T21:30:50Z,Virginia Department of Education
mAzST8Z4hFM,"November 18, 2020 - Special Committee to Review the Standards of Accreditation",2020-11-18T22:15:39Z,Virginia Department of Education
AJh2dVXACOQ,November Difference Makers,2020-11-18T12:06:51Z,Virginia Department of Education
jtGmsdoDxKA,ABTEL Meeting,2020-11-16T18:58:30Z,Virginia Department of Education
0XDYu81MCfI,VDOE Legislator Briefing,2020-11-13T18:42:26Z,Virginia Department of Education
QaQlKf04dZo,Implementing the New Energy Career Cluster,2020-11-12T21:08:47Z,Virginia Department of Education
Tv20U3RVZxE,VDOE Legislator Briefing,2020-11-12T18:02:46Z,Virginia Department of Education
_34PGz2D25E,Strengthening Your Capacity to Support Week 2,2020-11-08T05:00:07Z,Virginia Department of Education
DTKc7G8gxLw,CTE Program and Course Applications,2020-11-05T20:28:15Z,Virginia Department of Education
AApgoFAR1PU,Beginning of the School Year Finance Guidance,2020-10-29T20:47:34Z,Virginia Department of Education
EAtngqKcCHs,Strengthening Your Capacity to Support Week 1,2020-10-28T22:18:03Z,Virginia Department of Education
YTb3NoF9aNQ,Assessment Supports 2020-2021: End-of-Course Reading,2020-10-22T21:46:23Z,Virginia Department of Education
C-H4H0MW2n0,Virginia CTE Advisory Committee Webinar,2020-10-22T18:29:14Z,Virginia Department of Education
8peeiirHAc8,Assessment Supports 2020-2021: Grade Eight Reading,2020-10-21T20:36:59Z,Virginia Department of Education
3IRK2jCe8KU,Assessment Supports 2020-2021: Grade Seven Reading,2020-10-21T13:14:09Z,Virginia Department of Education
0E8LdcCcLQs,Strengthening Your Capacity to Support Introduction to Series,2020-10-20T15:27:04Z,Virginia Department of Education
Zbihs3OQp1A,Assessment Supports: Grade Six Reading,2020-10-19T21:00:32Z,Virginia Department of Education
qYcpHOrmZ6c,Assessment Supports 2020-2021: Grade Five Reading,2020-10-16T19:09:09Z,Virginia Department of Education
wwM7J8Y9bU8,Assessment Supports: Grade Four Reading,2020-10-15T21:17:26Z,Virginia Department of Education
dfe_FD2V8Sw,"October 15, 2020 - Board Business Meeting",2020-10-15T19:38:06Z,Virginia Department of Education
DkU0tVbrP4U,Strengthening Collaborative Efforts  Improved Student Mental Health,2020-10-15T17:05:48Z,Virginia Department of Education
5w1i2Pfq7ms,"October 14, 2020 - Special Committee to Review the Standards of Accreditation",2020-10-14T22:21:26Z,Virginia Department of Education
r_MyqZnOlhk,Virginia Board of Education's Personal Meeting Room,2020-10-14T18:14:38Z,Virginia Department of Education
zfq37tRo_Yo,Virginia Board of Education's Personal Meeting Room,2020-10-14T17:15:49Z,Virginia Department of Education
B3j_Q_uSs_g,Virginia Department of Education Live Stream,2020-10-14T14:31:24Z,Virginia Department of Education
Q4rjF_aFduU,October 2020 - State Special Education Advisory Committee (SSEAC) Meeting,2020-10-09T18:48:04Z,Virginia Department of Education
lJzJqTv6d1k,Virginia Council on the Interste Compact for the Educational Opportunity of Military Children_2,2020-10-09T17:55:51Z,Virginia Department of Education
gVqXRiAUuL4,Virginia Council on the Interste Compact for the Educational Opportunity of Military Children,2020-10-09T17:24:12Z,Virginia Department of Education
vWwuJkew6mg,Mary V. Bicouvaris 2021 Virginia Teacher of the Year Program,2020-10-08T22:36:47Z,Virginia Department of Education
0XY9HSIlbzY,Adult Education and Literacy Adv. Committee,2020-10-08T19:48:37Z,Virginia Department of Education
oMC0c7INct0,October 2020 - State Special Education Advisory Committee (SSEAC) Meeting,2020-10-08T19:21:45Z,Virginia Department of Education
r5eNN7UCrxU,October 2020 - State Special Education Advisory Committee (SSEAC) Meeting,2020-10-07T19:53:57Z,Virginia Department of Education
333RT6fVx8c,VACEG Meeting,2020-10-06T19:32:44Z,Virginia Department of Education
wEif-4qNWL0,Virtual Learning Advisory Committee (VLAC) Meeting,2020-09-24T17:31:05Z,Virginia Department of Education
kasLbk9gelQ,My Meeting,2020-09-21T20:21:58Z,Virginia Department of Education
Qy9_eTP40mg,"September 17, 2020 - Board Business Meeting",2020-09-17T20:45:55Z,Virginia Department of Education
8FApFeZ-_Z0,"September 16, 2020 - Special Committee to Review the Standards of Accreditation",2020-09-16T23:05:00Z,Virginia Department of Education
Eh2fOvXg4VA,Virginia Board of Education's Personal Meeting Room,2020-09-16T19:21:15Z,Virginia Department of Education
2N0xO9h_t7o,"September 16, 2020 - Board of Education Executive Session",2020-09-16T16:42:30Z,Virginia Department of Education
Gw2Mm_aCvx0,Virtual Public Hearing on 2020 Proposed Computer Technology Standards of Learning,2020-09-15T01:01:24Z,Virginia Department of Education
_m_wh0bQEXE,August 27 - Special Committee to Review the Standards of Accreditation,2020-08-27T18:43:01Z,Virginia Department of Education
HpxprL7ccNg,"July 23, 2020 - Board Business Meeting",2020-07-23T18:28:29Z,Virginia Department of Education
GZ5k1Xr-TQw,"July 22, 2020 - Special Committee to Review the Standards of Accreditation",2020-07-22T23:13:08Z,Virginia Department of Education
bGgmVCuUSy4,"July 22, 2020 Executive Session Part 2",2020-07-22T20:13:42Z,Virginia Department of Education
tLiLP8EpnrI,"July 22, 2020 Executive Session",2020-07-22T16:31:57Z,Virginia Department of Education
Uh_2yv_BBDU,VIRTUAL SSEAC MEETING,2020-07-16T20:10:21Z,Virginia Department of Education
jgguYIllqdI,"June 18, 2020 - Special Committee to Review the Standards of Accreditation",2020-06-18T22:35:02Z,Virginia Department of Education
e7xKkm2V8Ok,"June 18, 2020 Board Business Meeting",2020-06-18T20:46:50Z,Virginia Department of Education
HCYMQXsoLYs,"June 17, 2020 - Special Committee to Review the Standards of Accreditation",2020-06-18T02:16:27Z,Virginia Department of Education
npelSu7cq3g,"June 17, 2020 Executive Session",2020-06-17T23:21:03Z,Virginia Department of Education
84pNWxvMd8Y,"June 17, 2020 Executive Session",2020-06-17T22:40:32Z,Virginia Department of Education
agI9WvKEkYg,ABTEL Meeting,2020-06-04T21:15:12Z,Virginia Department of Education
HW3kap9QnrY,Board of Education Executive Session,2020-06-03T00:11:44Z,Virginia Department of Education
7KhyB0uF75g,Board of Education Executive Session,2020-06-02T21:34:38Z,Virginia Department of Education
qZ239POaKFM,Virginia Board of Education Meeting,2020-05-07T22:57:42Z,Virginia Department of Education
PGq2VD1xP_U,Teacher Appreciation week 2020,2020-05-05T22:06:38Z,Virginia Department of Education
mw9_iIlBQ_I,01/23/2020 Board of Education Business Meeting,2020-01-23T17:55:10Z,Virginia Department of Education
nOFi0G4FGeI,Virginia Interstate Compact Council - December 19th 2019,2019-12-19T16:30:43Z,Virginia Department of Education
Sph_V8_z7Rw,Virginia Board of Education Public Session 11/14/2019,2019-11-14T15:24:47Z,Virginia Department of Education
4DzFkGC_lsQ,Virginia Board of Education Work Session 11/13/2019,2019-11-13T21:14:07Z,Virginia Department of Education
KVi1D2Hojw8,Board of Education 11/13/2019,2019-11-13T17:55:40Z,Virginia Department of Education
diQFITvJ_EM,Virginia Department of Education - Business Session,2019-10-17T16:09:35Z,Virginia Department of Education
Kqis3SdMta0,Virginia Board of Education - Work Session,2019-10-16T21:01:53Z,Virginia Department of Education
5is5FErk7_Y,Virginia Dept Edu. Public Session,2019-10-16T17:27:21Z,Virginia Department of Education
SvhwUNvV9Uk,Virginia Interstate Compact Council - Public Session,2019-10-02T16:07:18Z,Virginia Department of Education
yknf3QrHQpw,The Virginia Interstate Compact Council,2019-10-02T15:53:45Z,Virginia Department of Education
3fszVdBreqU,Board of Education 09/19/19 Public Session,2019-09-19T17:13:33Z,Virginia Department of Education
_LYRNcNqebk,Board of Education 09/19/2019 Business Session,2019-09-19T15:46:40Z,Virginia Department of Education
liOj50GaGVw,Board of Education 09/18/2019 Work Session,2019-09-18T19:37:41Z,Virginia Department of Education
lNT7f81Jf5A,Board of Education 09/18/2019 SOQ,2019-09-18T18:55:48Z,Virginia Department of Education
0fHw_2blK8o,Intern,2018-03-29T14:58:16Z,Virginia Department of Education
8XHTYJo-wbA,State Special Education Advisory Committee,2018-03-14T15:59:29Z,Virginia Department of Education
VFRrdVQSmqg,"Session 8: Beginning-of-Year: Financial Information, Reimbursements, and Reports",2017-09-14T17:23:00Z,Virginia Department of Education
www4_9Tbuok,Session 5: Implementing Career Clusters: Preparing Students,2017-08-24T17:09:36Z,Virginia Department of Education
lWelNz4ddPI,2017 Teacher of the Year,2016-10-21T14:17:26Z,Virginia Department of Education
lqGOhyIear0,The Virginia Indians: Meet the Tribes,2016-07-20T19:15:15Z,Virginia Department of Education
tmDTFpv3b6A,2016 Virginia Teacher of the Year,2016-03-14T15:25:51Z,Virginia Department of Education
9mcoVxQLAsE,Why subscribe to TeacherDirect?,2016-03-14T15:25:50Z,Virginia Department of Education
